month,day,total,total-color,retweets,retweets-color,original,original-color,highestLikes,highestLikes-color,highestRetweets,highestRetweets-color,totalLikes,totalLikes-color,letters,letters-color,capitalLetters,capitalLetters-color,loudness,loudness-color,likeRate,likeRate-color,totalRetweets,totalRetweets-color,retweetRate,retweetRate-color,most-popular-text,most-popular-id,most-popular-date
2017-01-01,1,6,#edf7fe,5,#e3f3fd,1,#fcfeff,126230,#ddf1fd,32665,#d7eefd,126230,#f5fbfe,93,#fcfeff,18,#fafdff,19.35483870967742,#9dd5f9,21038.333333333332,#f2f9fe,72804,#f0f9fe,12134,#c9e9fc,"TO ALL AMERICANS-
#HappyNewYear &amp; many blessings to you all! Looking forward to a wonderful &amp; prosperous 2017 as we… https://t.co/1asdMAL4iy",815422340540547073,2017-01-01 06:00
2017-01-01,2,5,#f0f8fe,0,#ffffff,5,#f0f8fe,124024,#ddf1fd,29248,#dbf0fd,311181,#e6f4fe,459,#f1f9fe,42,#f4fafe,9.15032679738562,#d0ebfc,62236.2,#d8effd,73101,#f0f9fe,14620.2,#bee4fb,"Well&#44; the New Year begins. We will&#44; together&#44; MAKE AMERICA GREAT AGAIN!",815930688889352192,2017-01-02 03:40
2017-01-01,3,11,#ddf1fd,0,#ffffff,11,#ddf1fd,92256,#e6f4fe,26703,#def1fd,671413,#c9e8fc,1076,#dff1fd,93,#e6f4fd,8.643122676579926,#d3ecfc,61037.545454545456,#d9effd,173538,#dbf0fd,15776.181818181818,#b9e2fb,"North Korea just stated that it is in the final stages of developing a nuclear weapon capable of reaching parts of the U.S. It won't happen!",816057920223846400,2017-01-03 12:05
2017-01-01,4,11,#ddf1fd,0,#ffffff,11,#ddf1fd,86542,#e8f5fe,23441,#e2f3fd,642879,#cbe9fc,1123,#ddf1fd,75,#ebf6fe,6.678539626001781,#ddf1fd,58443.545454545456,#dbf0fd,164608,#ddf1fd,14964.363636363636,#bce3fb,"Thank you to Ford for scrapping a new plant in Mexico and creating 700 new jobs in the U.S. This is just the beginning - much more to follow",816635078067490816,2017-01-04 02:19
2017-01-01,5,6,#edf7fe,0,#ffffff,6,#edf7fe,107842,#e2f3fd,32121,#d7eefd,421006,#def1fd,642,#ecf7fe,53,#f1f9fe,8.255451713395638,#d5edfc,70167.66666666667,#d3edfc,105763,#e9f6fe,17627.166666666668,#b2defa,"Toyota Motor said will build a new plant in Baja&#44; Mexico&#44; to build Corolla cars for U.S. NO WAY! Build plant in U.S. or pay big border tax.",817071792711942145,2017-01-05 07:14
2017-01-01,6,12,#daeffd,0,#ffffff,12,#daeffd,96091,#e5f4fd,26007,#dff1fd,725071,#c4e7fb,1277,#d9effd,132,#dbf0fd,10.33672670321065,#cae9fc,60422.583333333336,#daeffd,185275,#d9effd,15439.583333333334,#bbe2fb,"Monitoring the terrible situation in Florida. Just spoke to Governor Scott. Thoughts and prayers for all. Stay safe!",817453219613917185,2017-01-06 08:30
2017-01-01,7,7,#eaf6fe,0,#ffffff,7,#eaf6fe,100987,#e4f3fd,29384,#dbf0fd,518190,#d6eefc,683,#ebf6fe,32,#f6fbfe,4.685212298682284,#e7f5fe,74027.14285714286,#d1ecfc,126499,#e5f4fd,18071.285714285714,#b0defa,"Having a good relationship with Russia is a good thing&#44; not a bad thing. Only &#34;stupid&#34; people&#44; or fools&#44; would think that it is bad! We.....",817748207694467072,2017-01-07 04:02
2017-01-01,8,7,#eaf6fe,1,#f9fdff,6,#edf7fe,85216,#e8f5fe,20653,#e6f4fd,346708,#e4f3fd,589,#eef8fe,43,#f3fafe,7.300509337860781,#daeffd,49529.71428571428,#e0f2fd,88280,#edf7fe,12611.42857142857,#c7e8fc,"I look very much forward to meeting Prime Minister Theresa May in Washington in the Spring. Britain&#44; a longtime U.S. ally&#44; is very special!",817915516018892805,2017-01-08 03:07
2017-01-01,9,8,#e7f5fe,0,#ffffff,8,#e7f5fe,123554,#def1fd,37502,#d1ebfc,726207,#c4e7fb,781,#e8f5fe,48,#f2f9fe,6.145966709346991,#e0f2fd,90775.875,#c6e7fc,172996,#dbf0fd,21624.5,#a1d7fa,"An old picture with Nancy and Ronald Reagan. https://t.co/8kvQ1PzPAf",818586286034485250,2017-01-09 11:32
2017-01-01,10,4,#f3fafe,0,#ffffff,4,#f3fafe,93051,#e6f4fd,23231,#e3f3fd,228134,#edf7fe,224,#f8fcff,24,#f9fcff,10.714285714285714,#c8e8fc,57033.5,#dcf0fd,56680,#f3fafe,14170,#c0e5fb,"Thank you to all of the men and women who protect &amp; serve our communities 24/7/365! 
#LawEnforcementAppreciationDay… https://t.co/aqUbDipSgv",818643528905621504,2017-01-10 03:20
2017-01-01,11,7,#eaf6fe,1,#f9fdff,6,#edf7fe,115066,#e0f2fd,31725,#d8eefd,514637,#d6eefc,502,#f0f9fe,149,#d6eefd,29.681274900398407,#69bff7,73519.57142857143,#d1ecfc,156971,#dff1fd,22424.428571428572,#9dd5f9,"I win an election easily&#44; a great &#34;movement&#34; is verified&#44; and crooked opponents try to belittle our victory with FAKE NEWS. A sorry state!",819162968592183298,2017-01-11 01:44
2017-01-01,12,6,#edf7fe,0,#ffffff,6,#edf7fe,127608,#dcf0fd,35250,#d3edfc,547614,#d3edfc,621,#edf7fe,66,#edf7fe,10.628019323671497,#c8e8fc,91269,#c6e7fb,130610,#e4f4fd,21768.333333333332,#a0d7fa,".@CNN is in a total meltdown with their FAKE NEWS because their ratings are tanking since election and their credibility will soon be gone!",819550083742109696,2017-01-12 03:22
2017-01-01,13,8,#e7f5fe,0,#ffffff,8,#e7f5fe,129591,#dcf0fd,30025,#daeffd,626433,#cdeafc,807,#e7f5fe,45,#f3fafe,5.5762081784386615,#e3f3fd,78304.125,#ceeafc,136100,#e3f3fd,17012.5,#b4dffb,"The &#34;Unaffordable&#34; Care Act will soon be history!",819869953692155904,2017-01-13 12:33
2017-01-01,14,3,#f6fbfe,0,#ffffff,3,#f6fbfe,87998,#e7f5fe,21049,#e5f4fd,233300,#edf7fe,279,#f7fbff,68,#edf7fe,24.372759856630825,#82caf8,77766.66666666667,#ceebfc,56654,#f3fafe,18884.666666666668,#acdcfa,"Congressman John Lewis should spend more time on fixing and helping his district&#44; which is in horrible shape and falling apart (not to......",820251730407473153,2017-01-14 01:50
2017-01-01,15,8,#e7f5fe,0,#ffffff,8,#e7f5fe,127759,#dcf0fd,29527,#dbf0fd,726576,#c4e7fb,844,#e6f4fd,68,#edf7fe,8.056872037914692,#d6eefc,90822,#c6e7fc,158347,#def1fd,19793.375,#a9dafa,"For many years our country has been divided&#44; angry and untrusting. Many say it will never change&#44; the hatred is too deep. IT WILL CHANGE!!!!",820707210565132288,2017-01-15 08:00
2017-01-01,16,3,#f6fbfe,0,#ffffff,3,#f6fbfe,161320,#d3ecfc,37896,#d0ebfc,265493,#eaf6fe,319,#f6fbfe,29,#f7fcff,9.090909090909092,#d0ebfc,88497.66666666667,#c8e8fc,63332,#f2f9fe,21110.666666666668,#a3d8fa,"Celebrate Martin Luther King Day and all of the many wonderful things that he stood for. Honor him for being the great man that he was!",820992721120854016,2017-01-16 02:54
2017-01-01,17,13,#d7eefd,2,#f4fafe,11,#ddf1fd,120615,#def1fd,24946,#e0f2fd,786500,#bfe4fb,1041,#e0f2fd,69,#ecf7fe,6.628242074927954,#ddf1fd,60500,#daeffd,182213,#d9effd,14016.384615384615,#c1e5fb,"People are pouring into Washington in record numbers. Bikers for Trump are on their way. It will be a great Thursday&#44; Friday and Saturday!",821342600322043905,2017-01-17 02:05
2017-01-01,18,8,#e7f5fe,0,#ffffff,8,#e7f5fe,135864,#daeffd,21141,#e5f4fd,568009,#d2ecfc,756,#e9f5fe,71,#ecf7fe,9.39153439153439,#cfebfc,71001.125,#d3ecfc,103508,#eaf6fe,12938.5,#c6e7fb,"Looking forward to a speedy recovery for George and Barbara Bush&#44; both hospitalized. Thank you for your wonderful letter!",821844875268255744,2017-01-18 11:21
2017-01-01,19,8,#e7f5fe,0,#ffffff,8,#e7f5fe,159832,#d4edfc,38818,#cfebfc,769993,#c1e5fb,568,#eef8fe,68,#edf7fe,11.971830985915492,#c1e5fb,96249.125,#c2e6fb,148230,#e1f2fd,18528.75,#aeddfa,"the American people. I have no doubt that we will&#44; together&#44; MAKE AMERICA GREAT AGAIN!",822066653953458177,2017-01-19 02:02
2017-01-01,20,13,#d7eefd,0,#ffffff,13,#d7eefd,268372,#b6e0fb,70523,#a8dafa,1867501,#6cc0f7,955,#e3f3fd,117,#dff1fd,12.25130890052356,#bfe5fb,143653.92307692306,#a6d9fa,417567,#a9dbfa,32120.53846153846,#73c3f7,"It all begins today! I will see you at 11:00 A.M. for the swearing-in. THE MOVEMENT CONTINUES - THE WORK BEGINS!",822421390125043713,2017-01-20 01:31
2017-01-01,21,2,#f9fcff,0,#ffffff,2,#f9fcff,289942,#b0defa,52468,#bde4fb,467521,#daeffd,191,#f9fdff,52,#f1f9fe,27.225130890052355,#75c4f7,233760.5,#6fc2f7,75805,#f0f8fe,37902.5,#5cb9f6,"THANK YOU for another wonderful evening in Washington&#44; D.C. TOGETHER&#44; we will MAKE AMERICA GREAT AGAIN🇺🇸 https://t.co/V3aoj9RUh4",822669114237943808,2017-01-21 05:56
2017-01-01,22,5,#f0f8fe,1,#f9fdff,4,#f3fafe,390826,#95d2f9,81527,#9bd4f9,949408,#b3dffa,442,#f2f9fe,18,#fafdff,4.072398190045249,#eaf6fe,189881.6,#89cdf9,212249,#d3ecfc,42449.8,#45b0f4,"Peaceful protests are a hallmark of our democracy. Even if I don't always agree&#44; I recognize the rights of people to express their views.",823174199036542980,2017-01-22 03:23
2017-01-01,23,1,#fcfeff,0,#ffffff,1,#fcfeff,177839,#ceebfc,26750,#def1fd,177839,#f1f9fe,108,#fcfeff,5,#fefeff,4.62962962962963,#e8f5fe,177839,#91d0f9,26750,#fafdff,26750,#8acdf9,"Busy week planned with a heavy focus on jobs and national security. Top executives coming in at 9:00 A.M. to talk manufacturing in America.",823495059010109440,2017-01-23 12:38
2017-01-01,24,4,#f3fafe,0,#ffffff,4,#f3fafe,154857,#d5edfc,25694,#dff2fd,495813,#d7eefd,368,#f4fafe,22,#f9fcff,5.978260869565218,#e1f2fd,123953.25,#b2defa,86707,#edf7fe,21676.75,#a1d7fa,"Will be meeting at 9:00 with top automobile executives concerning jobs in America. I want new plants to be built here for cars sold here!",823850781946343427,2017-01-24 12:11
2017-01-01,25,8,#e7f5fe,0,#ffffff,8,#e7f5fe,209363,#c6e7fb,56038,#b9e2fb,1112361,#a7d9fa,725,#e9f6fe,79,#eaf6fe,10.89655172413793,#c7e7fc,139045.125,#a9dafa,240014,#cdeafc,30001.75,#7bc7f8,"If Chicago doesn't fix the horrible &#34;carnage&#34; going on&#44; 228 shootings in 2017 with 42 killings (up 24% from 2016)&#44; I will send in the Feds!",824080766288228352,2017-01-25 03:25
2017-01-01,26,9,#e3f3fd,0,#ffffff,9,#e3f3fd,152335,#d6eefc,29219,#dbf0fd,784423,#bfe5fb,809,#e7f5fe,95,#e5f4fd,11.742892459826948,#c2e6fb,87158.11111111111,#c8e8fc,158680,#def1fd,17631.11111111111,#b2defa,"As your President&#44; I have no higher duty than to protect the lives of the American people. https://t.co/o7YNUNwb8f",824440456813707265,2017-01-26 03:14
2017-01-01,27,8,#e7f5fe,0,#ffffff,8,#e7f5fe,184954,#cceafc,45457,#c6e7fc,878511,#b8e1fb,527,#eff8fe,45,#f3fafe,8.538899430740038,#d3edfc,109813.875,#bae2fb,174653,#dbf0fd,21831.625,#a0d7fa,"The #MarchForLife is so important. To all of you marching --- you have my full support!",825017279209410561,2017-01-27 05:27
2017-01-01,28,6,#edf7fe,0,#ffffff,6,#edf7fe,170093,#d1ebfc,32623,#d7eefd,614935,#ceeafc,532,#eff8fe,51,#f1f9fe,9.586466165413533,#ceeafc,102489.16666666667,#bee4fb,112288,#e8f5fe,18714.666666666668,#addcfa,"Today&#44; we remember the crew of the Space Shuttle Challenger&#44; 31 years later. #NeverForget https://t.co/OhshQsFRfl",825368580325773312,2017-01-28 04:42
2017-01-01,29,5,#f0f8fe,0,#ffffff,5,#f0f8fe,223856,#c1e5fb,59432,#b5e0fb,832012,#bce3fb,541,#eff8fe,36,#f5fbfe,6.654343807763401,#ddf1fd,166402.4,#98d3f9,198262,#d6eefd,39652.4,#54b6f5,"Christians in the Middle-East have been executed in large numbers. We cannot allow this horror to continue!",825721153142521858,2017-01-29 04:03
2017-01-01,30,9,#e3f3fd,0,#ffffff,9,#e3f3fd,176861,#cfebfc,35502,#d3ecfc,1213983,#9fd6fa,837,#e6f4fd,67,#edf7fe,8.004778972520908,#d6eefd,134887,#acdcfa,245642,#cceafc,27293.555555555555,#87ccf8,"The American dream is back. We’re going to create an environment for small business like we haven’t had in many&#44; ma… https://t.co/Bh7SrNEgz1",826175120238604288,2017-01-30 10:07
2017-01-01,31,3,#f6fbfe,0,#ffffff,3,#f6fbfe,179221,#ceeafc,38848,#cfebfc,459100,#daf0fd,331,#f5fbfe,26,#f8fcff,7.854984894259819,#d7eefd,153033.33333333334,#a1d7fa,97752,#ebf6fe,32584,#71c3f7,"When will the Democrats give us our Attorney General and rest of Cabinet! They should be ashamed of themselves! No wonder D.C. doesn't work!",826391334248407040,2017-01-31 12:27
2017-02-01,1,4,#f3fafe,0,#ffffff,4,#f3fafe,252382,#bae2fb,60583,#b4dffb,659762,#cae9fc,290,#f6fbfe,41,#f4fafe,14.137931034482758,#b6e0fb,164940.5,#99d4f9,117869,#e7f5fe,29467.25,#7dc8f8,"Everybody is arguing whether or not it is a BAN. Call it what you want&#44; it is about keeping bad people (with bad intentions) out of country!",826774668245946368,2017-02-01 01:50
2017-02-01,2,8,#e7f5fe,0,#ffffff,8,#e7f5fe,213655,#c4e7fb,60266,#b4e0fb,1042808,#acdcfa,772,#e8f5fe,67,#edf7fe,8.678756476683938,#d3ecfc,130351,#aeddfa,241111,#cdeafc,30138.875,#7bc7f8,"If U.C. Berkeley does not allow free speech and practices violence on innocent people with a different point of view - NO FEDERAL FUNDS?",827112633224544256,2017-02-02 12:13
2017-02-01,3,6,#edf7fe,0,#ffffff,6,#edf7fe,173210,#d0ebfc,64118,#b0defa,901278,#b7e1fb,632,#ecf7fe,69,#ecf7fe,10.917721518987342,#c7e7fc,150213,#a2d8fa,223372,#d1ebfc,37228.666666666664,#5fbaf6,"Iran is playing with fire - they don't appreciate how &#34;kind&#34; President Obama was to them. Not me!",827478751931924480,2017-02-03 12:28
2017-02-01,4,9,#e3f3fd,0,#ffffff,9,#e3f3fd,255896,#b9e2fb,66140,#aedcfa,1478391,#89cdf9,826,#e6f5fe,54,#f0f9fe,6.5375302663438255,#def1fd,164265.66666666666,#9ad4f9,318144,#bce3fb,35349.333333333336,#67bdf6,"MAKE AMERICA GREAT AGAIN!",827885966509604865,2017-02-04 03:26
2017-02-01,5,7,#eaf6fe,0,#ffffff,7,#eaf6fe,185073,#cceafc,36535,#d2ecfc,768763,#c1e5fb,648,#ecf7fe,69,#ecf7fe,10.648148148148149,#c8e8fc,109823.28571428571,#bae2fb,151588,#e0f2fd,21655.428571428572,#a1d7fa,"Enjoy the #SuperBowl and then we continue: MAKE AMERICA GREAT AGAIN!",828375073006444544,2017-02-05 11:49
2017-02-01,6,5,#f0f8fe,0,#ffffff,5,#f0f8fe,267584,#b6e0fb,72934,#a6d9fa,651407,#cbe9fc,458,#f1f9fe,35,#f6fbfe,7.641921397379913,#d8eefd,130281.4,#aeddfa,152437,#e0f2fd,30487.4,#79c7f8,"What an amazing comeback and win by the Patriots. Tom Brady&#44; Bob Kraft and Coach B are total winners. Wow!",828447350200926212,2017-02-06 04:36
2017-02-01,7,6,#edf7fe,0,#ffffff,6,#edf7fe,188271,#cce9fc,50474,#c0e5fb,587659,#d0ebfc,593,#edf7fe,31,#f7fbfe,5.227655986509275,#e4f4fd,97943.16666666667,#c1e5fb,125890,#e5f4fd,20981.666666666668,#a4d8fa,"I don't know Putin&#44; have no deals in Russia&#44; and the haters are going crazy - yet Obama can make a deal with Iran&#44; #1 in terror&#44; no problem!",828939235499638784,2017-02-07 01:11
2017-02-01,8,11,#ddf1fd,0,#ffffff,11,#ddf1fd,157210,#d4edfc,36410,#d2ecfc,1124028,#a6d9fa,942,#e3f3fd,92,#e6f4fd,9.766454352441613,#cdeafc,102184.36363636363,#bfe4fb,241568,#cdeafc,21960.727272727272,#9fd6fa,"It is a disgrace that my full Cabinet is still not in place&#44; the longest such delay in the history of our country. Obstruction by Democrats!",829133645055135750,2017-02-08 02:04
2017-02-01,9,7,#eaf6fe,0,#ffffff,7,#eaf6fe,163235,#d3ecfc,32534,#d7eefd,637701,#cce9fc,672,#ebf6fe,47,#f2fafe,6.994047619047619,#dbf0fd,91100.14285714286,#c6e7fb,120037,#e6f5fe,17148.14285714286,#b4dffb,"Congratulations to our new Attorney General&#44; @SenatorSessions! https://t.co/e0buP1K83z",829496507841789952,2017-02-09 02:05
2017-02-01,10,3,#f6fbfe,0,#ffffff,3,#f6fbfe,237614,#bde4fb,67448,#acdcfa,433769,#ddf0fd,250,#f8fcff,69,#ecf7fe,27.6,#73c3f7,144589.66666666666,#a6d9fa,108736,#e9f5fe,36245.333333333336,#63bcf6,"SEE YOU IN COURT&#44; THE SECURITY OF OUR NATION IS AT STAKE!",829836231802515457,2017-02-10 12:35
2017-02-01,11,6,#edf7fe,0,#ffffff,6,#edf7fe,160212,#d3edfc,40351,#cdeafc,634477,#cceafc,552,#eff8fe,69,#ecf7fe,12.5,#bee4fb,105746.16666666667,#bce3fb,124116,#e6f4fd,20686,#a5d9fa,"Heading to Joint Base Andrews on #MarineOne with Prime Minister Shinzō earlier today. https://t.co/4JFhyYdeHO",830195857530183684,2017-02-11 12:24
2017-02-01,12,13,#d7eefd,1,#f9fdff,12,#daeffd,207438,#c6e7fc,29437,#dbf0fd,1202598,#a0d6fa,1194,#dbf0fd,146,#d7eefd,12.22780569514238,#bfe5fb,92507.53846153847,#c5e7fb,222053,#d1ecfc,17081,#b4dffb,"I am so proud of my daughter Ivanka. To be abused and treated so badly by the media&#44; and to still hold her head so high&#44; is truly wonderful!",830552079240409089,2017-02-12 12:00
2017-02-01,13,3,#f6fbfe,0,#ffffff,3,#f6fbfe,85397,#e8f5fe,15431,#ecf7fe,244511,#ecf7fe,238,#f8fcff,23,#f9fcff,9.663865546218487,#cdeafc,81503.66666666667,#cceafc,40660,#f7fbff,13553.333333333334,#c3e6fb,"Wonderful meeting with Canadian PM @JustinTrudeau and a group of leading CEO's &amp; business women from Canada🇨🇦and th… https://t.co/wAoCOaYeZ6",831214091993751552,2017-02-13 07:50
2017-02-01,14,6,#edf7fe,0,#ffffff,6,#edf7fe,111318,#e1f2fd,26588,#def1fd,459057,#daf0fd,490,#f1f9fe,48,#f2f9fe,9.795918367346939,#cdeafc,76509.5,#cfebfc,91482,#ecf7fe,15247,#bbe3fb,"The real story here is why are there so many illegal leaks coming out of Washington? Will these leaks be happening as I deal on N.Korea etc?",831510532318429184,2017-02-14 03:28
2017-02-01,15,10,#e0f2fd,0,#ffffff,10,#e0f2fd,128448,#dcf0fd,31903,#d8eefd,881011,#b8e1fb,903,#e4f4fd,96,#e5f4fd,10.631229235880399,#c8e8fc,88101.1,#c8e8fc,205466,#d5edfc,20546.6,#a5d9fa,"The real scandal here is that classified information is illegally given out by &#34;intelligence&#34; like candy. Very un-American!",831853862281699331,2017-02-15 02:13
2017-02-01,16,6,#edf7fe,0,#ffffff,6,#edf7fe,127764,#dcf0fd,53977,#bce3fb,674313,#c9e8fc,591,#edf7fe,28,#f7fcff,4.737732656514383,#e7f5fe,112385.5,#b9e2fb,166998,#ddf0fd,27833,#85cbf8,"Stock market hits new high with longest winning streak in decades. Great level of confidence and optimism - even before tax plan rollout!",832191485701451777,2017-02-16 12:34
2017-02-01,17,8,#e7f5fe,0,#ffffff,8,#e7f5fe,162368,#d3ecfc,52654,#bde4fb,735253,#c4e6fb,632,#ecf7fe,75,#ebf6fe,11.867088607594937,#c1e5fb,91906.625,#c5e7fb,150288,#e0f2fd,18786,#addcfa,"The FAKE NEWS media (failing @nytimes&#44; @NBCNews&#44; @ABC&#44; @CBS&#44; @CNN) is not my enemy&#44; it is the enemy of the American People!",832708293516632065,2017-02-17 10:48
2017-02-01,18,5,#f0f8fe,0,#ffffff,5,#f0f8fe,186074,#cceafc,39020,#cfebfc,504842,#d7eefd,429,#f2fafe,51,#f1f9fe,11.888111888111888,#c1e5fb,100968.4,#bfe5fb,90164,#edf7fe,18032.8,#b0defa,"Don't believe the main stream (fake news) media.The White House is running VERY WELL. I inherited a MESS and am in the process of fixing it.",832945737625387008,2017-02-18 02:31
2017-02-01,19,1,#fcfeff,0,#ffffff,1,#fcfeff,112115,#e1f2fd,26224,#dff1fd,112115,#f6fbfe,113,#fcfeff,5,#fefeff,4.424778761061947,#e9f5fe,112115,#b9e2fb,26224,#fafdff,26224,#8ccef9,"My statement as to what's happening in Sweden was in reference to a story that was broadcast on @FoxNews concerning immigrants &amp; Sweden.",833435244451753984,2017-02-19 10:57
2017-02-01,20,4,#f3fafe,0,#ffffff,4,#f3fafe,242519,#bce3fb,48802,#c2e6fb,489861,#d8eefd,252,#f8fcff,68,#edf7fe,26.984126984126984,#76c5f7,122465.25,#b3dffa,99441,#ebf6fe,24860.25,#93d1f9,"HAPPY PRESIDENTS DAY - MAKE AMERICA GREAT AGAIN!",833686030679207936,2017-02-20 03:33
2017-02-01,21,2,#f9fcff,0,#ffffff,2,#f9fcff,106937,#e2f3fd,23693,#e2f3fd,201006,#eff8fe,112,#fcfeff,11,#fcfeff,9.821428571428571,#cceafc,100503,#c0e5fb,39714,#f7fcff,19857,#a8dafa,"'Americans overwhelmingly oppose sanctuary cities' https://t.co/s5QvsJWA6u",834142323881684993,2017-02-21 09:46
2017-02-01,22,3,#f6fbfe,0,#ffffff,3,#f6fbfe,118125,#dff1fd,26055,#dff1fd,314095,#e6f4fd,330,#f5fbfe,21,#f9fdff,6.363636363636363,#dff1fd,104698.33333333333,#bde4fb,54407,#f4fafe,18135.666666666668,#b0ddfa,"The so-called angry crowds in home districts of some Republicans are actually&#44; in numerous cases&#44; planned out by liberal activists. Sad!",834181712783560705,2017-02-22 12:23
2017-02-01,23,1,#fcfeff,0,#ffffff,1,#fcfeff,56246,#f0f9fe,10563,#f2f9fe,56246,#fbfdff,42,#fefeff,9,#fdfeff,21.428571428571427,#92d1f9,56246,#dcf0fd,10563,#fdfeff,10563,#d1ebfc,"'S&amp;P 500 Edges Higher After Trump Renews Jobs Pledge' https://t.co/WtrRJVFmvU",834899071982841856,2017-02-23 11:53
2017-02-01,24,6,#edf7fe,0,#ffffff,6,#edf7fe,108261,#e2f3fd,23171,#e3f3fd,510786,#d6eefd,451,#f2f9fe,36,#f5fbfe,7.982261640798226,#d6eefd,85131,#cae9fc,100654,#eaf6fe,16775.666666666668,#b5e0fb,"Seven people shot and killed yesterday in Chicago. What is going on there - totally out of control. Chicago needs help!",834916167177371648,2017-02-24 01:01
2017-02-01,25,7,#eaf6fe,0,#ffffff,7,#eaf6fe,201400,#c8e8fc,62450,#b2defa,872943,#b9e2fb,678,#ebf6fe,77,#eaf6fe,11.35693215339233,#c4e6fb,124706.14285714286,#b1defa,205912,#d4edfc,29416,#7dc9f8,"The media has not reported that the National Debt in my first month went down by $12 billion vs a $200 billion increase in Obama first mo.",835479283699224576,2017-02-25 02:19
2017-02-01,26,4,#f3fafe,0,#ffffff,4,#f3fafe,113140,#e0f2fd,24677,#e1f2fd,415491,#def1fd,400,#f3fafe,26,#f8fcff,6.5,#def1fd,103872.75,#bde4fb,81258,#eef8fe,20314.5,#a6d9fa,"Russia talk is FAKE NEWS put out by the Dems&#44; and played up by the media&#44; in order to mask the big election defeat and the illegal leaks!",835916511944523777,2017-02-26 07:16
2017-02-01,27,2,#f9fcff,0,#ffffff,2,#f9fcff,89597,#e7f5fe,15400,#ecf7fe,160141,#f2fafe,166,#fafdff,20,#fafdff,12.048192771084338,#c0e5fb,80070.5,#cdeafc,30062,#f9fcff,15031,#bce3fb,"Great meeting with CEOs of leading U.S. health insurance companies who provide great healthcare to the American peo… https://t.co/60jigi6ffS",836261209540288513,2017-02-27 06:06
2017-02-01,28,1,#fcfeff,0,#ffffff,1,#fcfeff,82888,#e9f5fe,11039,#f2f9fe,82888,#f8fcff,42,#fefeff,4,#feffff,9.523809523809524,#ceeafc,82888,#cbe9fc,11039,#fdfeff,11039,#ceebfc,"I will be interviewed on @foxandfriends at 6:00 A.M. Enjoy!",836406328369242113,2017-02-28 03:43
2017-03-01,1,3,#f6fbfe,0,#ffffff,3,#f6fbfe,183969,#cdeafc,27371,#ddf1fd,302549,#e7f5fe,50,#fefeff,19,#fafdff,38,#3cadf3,100849.66666666667,#bfe5fb,44919,#f6fbfe,14973,#bce3fb,"THANK YOU!",836933725602656256,2017-03-01 02:38
2017-03-01,2,1,#fcfeff,0,#ffffff,1,#fcfeff,175684,#cfebfc,37270,#d1ecfc,175684,#f1f9fe,102,#fcfeff,12,#fcfeff,11.764705882352942,#c2e6fb,175684,#92d1f9,37270,#f7fcff,37270,#5ebaf6,"Since November 8th&#44; Election Day&#44; the Stock Market has posted $3.2 trillion in GAINS and consumer confidence is at a 15 year high. Jobs!",837256338203881472,2017-03-02 12:00
2017-03-01,3,13,#d7eefd,0,#ffffff,13,#d7eefd,150081,#d6eefd,54593,#bbe3fb,1130917,#a5d9fa,1061,#dff2fd,73,#ebf7fe,6.880301602262017,#dcf0fd,86993.61538461539,#c9e8fc,278109,#c5e7fb,21393,#a2d7fa,"We should start an immediate investigation into @SenSchumer and his ties to Russia and Putin. A total hypocrite! https://t.co/Ik3yqjHzsA",837722869106880517,2017-03-03 06:54
2017-03-01,4,7,#eaf6fe,0,#ffffff,7,#eaf6fe,162336,#d3ecfc,52836,#bde3fb,876769,#b8e1fb,753,#e9f5fe,52,#f1f9fe,6.905710491367862,#dcf0fd,125252.71428571429,#b1defa,261911,#c8e8fc,37415.857142857145,#5ebaf6,"How low has President Obama gone to tapp my phones during the very sacred election process. This is Nixon/Watergate. Bad (or sick) guy!",837996746236182529,2017-03-04 01:02
2017-03-01,5,3,#f6fbfe,0,#ffffff,3,#f6fbfe,172217,#d0ebfc,37134,#d1ecfc,394988,#e0f2fd,301,#f6fbfe,20,#fafdff,6.644518272425249,#ddf1fd,131662.66666666666,#addcfa,92413,#ecf7fe,30804.333333333332,#78c6f8,"Thank you for the great rallies all across the country. Tremendous support. Make America Great Again!",838441522546769923,2017-03-05 06:30
2017-03-01,6,3,#f6fbfe,0,#ffffff,3,#f6fbfe,116785,#dff2fd,24663,#e1f2fd,253094,#ebf6fe,268,#f7fcff,31,#f7fbfe,11.567164179104477,#c3e6fb,84364.66666666667,#cae9fc,51232,#f5fbfe,17077.333333333332,#b4dffb,"45&#44;000 construction &amp; manufacturing jobs in the U.S. Gulf Coast region. $20 billion investment. We are already winning again&#44; America!",838862312685637640,2017-03-06 10:22
2017-03-01,7,9,#e3f3fd,0,#ffffff,9,#e3f3fd,124413,#ddf1fd,25982,#dff1fd,876964,#b8e1fb,946,#e3f3fd,58,#eff8fe,6.13107822410148,#e0f2fd,97440.44444444444,#c2e5fb,182463,#d9effd,20273.666666666668,#a7d9fa,"I am working on a new system where there will be competition in the Drug Industry. Pricing for the American people will come way down!",839110000870109184,2017-03-07 02:46
2017-03-01,8,4,#f3fafe,0,#ffffff,4,#f3fafe,120999,#def1fd,23139,#e3f3fd,402397,#dff1fd,411,#f3fafe,18,#fafdff,4.37956204379562,#e9f6fe,100599.25,#c0e5fb,76093,#eff8fe,19023.25,#acdcfa,"I have tremendous respect for women and the many roles they serve that are vital to the fabric of our society and our economy.",839433678275153921,2017-03-08 12:12
2017-03-01,9,5,#f0f8fe,1,#f9fdff,4,#f3fafe,111369,#e1f2fd,21965,#e4f4fd,322802,#e5f4fd,271,#f7fcff,25,#f8fcff,9.22509225092251,#d0ebfc,64560.4,#d7eefd,79278,#eff8fe,15855.6,#b9e2fb,"Despite what you hear in the press&#44; healthcare is coming along great. We are talking to many groups and it will end in a beautiful picture!",839883804315684864,2017-03-09 06:01
2017-03-01,10,4,#f3fafe,2,#f4fafe,2,#f9fcff,56480,#f0f9fe,10506,#f2fafe,99468,#f7fcff,127,#fbfdff,21,#f9fdff,16.53543307086614,#abdbfa,24867,#f0f8fe,36299,#f8fcff,9074.75,#d7eefd,"Honored to meet this years @SenateYouth delegates w/ @VP Pence in the East Room of the @WhiteHouse. Congratulations… https://t.co/oQIx7LybCV",839976956703748096,2017-03-10 12:11
2017-03-01,11,1,#fcfeff,0,#ffffff,1,#fcfeff,103623,#e3f3fd,16563,#ebf6fe,103623,#f7fbff,114,#fcfeff,4,#feffff,3.508771929824561,#edf7fe,103623,#bee4fb,16563,#fcfeff,16563,#b6e0fb,"We are making great progress with healthcare. ObamaCare is imploding and will only get worse. Republicans coming together to get job done!",840572799202783233,2017-03-11 03:39
2017-03-01,12,1,#fcfeff,1,#f9fdff,0,#ffffff,0,#ffffff,6868,#f7fbff,0,#ffffff,0,#ffffff,0,#ffffff,,#ffffff,0,#ffffff,6868,#fefeff,6868,#e1f2fd,"RT @AmericaFirstPol: .@POTUS Trump led a historic journey to the White House. 50 days in&#44; that historic journey continues. Take a look 👉 ht…",840904454836781056,2017-03-12 01:36
2017-03-01,13,5,#f0f8fe,0,#ffffff,5,#f0f8fe,100557,#e4f3fd,19556,#e7f5fe,318317,#e6f4fd,442,#f2f9fe,32,#f6fbfe,7.239819004524887,#daeffd,63663.4,#d8eefd,60700,#f3fafe,12140,#c9e9fc,"It is amazing how rude much of the media is to my very hard working representatives. Be nice&#44; you will do much better!",841270741060464648,2017-03-13 01:52
