month,day,total,total-color,retweets,retweets-color,original,original-color,highestLikes,highestLikes-color,highestRetweets,highestRetweets-color,totalLikes,totalLikes-color,letters,letters-color,capitalLetters,capitalLetters-color,loudness,loudness-color,likeRate,likeRate-color,totalRetweets,totalRetweets-color,retweetRate,retweetRate-color,most-popular-text,most-popular-id,most-popular-date
2018-02-01,11,5,#f0f8fe,0,#ffffff,5,#f0f8fe,125039,#ddf1fd,32066,#d7eefd,543460,#d4edfc,961,#e2f3fd,63,#eef8fe,6.555671175858481,#def1fd,108692,#bbe2fb,127377,#e5f4fd,25475.4,#90d0f9,"4.2 million hard working Americans have already received a large Bonus and/or Pay Increase because of our recently Passed Tax Cut &amp; Jobs Bill....and it will only get better! We are far ahead of schedule.",962767075457593344,2018-02-11 08:15
2018-02-01,12,3,#f6fbfe,0,#ffffff,3,#f6fbfe,139472,#d9effd,30446,#daeffd,294353,#e8f5fe,416,#f3fafe,31,#f7fbfe,7.451923076923077,#d9effd,98117.66666666667,#c1e5fb,61687,#f2fafe,20562.333333333332,#a5d9fa,"This will be a big week for Infrastructure. After so stupidly spending $7 trillion in the Middle East&#44; it is now time to start investing in OUR Country!",963031666150313984,2018-02-12 01:46
2018-02-01,13,2,#f9fcff,0,#ffffff,2,#f9fcff,107190,#e2f3fd,22903,#e3f3fd,213186,#eef8fe,432,#f2fafe,20,#fafdff,4.62962962962963,#e8f5fe,106593,#bce3fb,45562,#f6fbfe,22781,#9cd5f9,"Negotiations on DACA have begun. Republicans want to make a deal and Democrats say they want to make a deal. Wouldn’t it be great if we could finally&#44; after so many years&#44; solve the DACA puzzle. This will be our last chance&#44; there will never be another opportunity! March 5th.",963365328716812288,2018-02-13 11:52
2018-02-01,14,4,#f3fafe,0,#ffffff,4,#f3fafe,174183,#d0ebfc,39628,#ceeafc,407809,#dff1fd,600,#edf7fe,22,#f9fcff,3.6666666666666665,#ecf7fe,101952.25,#bfe4fb,85537,#eef8fe,21384.25,#a2d7fa,"My prayers and condolences to the families of the victims of the terrible Florida shooting. No child&#44; teacher or anyone else should ever feel unsafe in an American school.",963878055969198080,2018-02-14 09:50
2018-02-01,15,7,#eaf6fe,1,#f9fdff,6,#edf7fe,100976,#e4f3fd,20780,#e6f4fd,467088,#daeffd,1126,#ddf1fd,60,#eff8fe,5.328596802841918,#e4f3fd,66726.85714285714,#d6edfc,117987,#e7f5fe,16855.285714285714,#b5e0fb,"While the Republicans and Democrats in Congress are working hard to come up with a solution to DACA&#44; they should be strongly considering a system of Merit Based Immigration so that we will have the people ready&#44; willing and able to help all of those companies moving into the USA!",964151653669711872,2018-02-15 03:57
2018-02-01,16,3,#f6fbfe,0,#ffffff,3,#f6fbfe,141288,#d9effd,37049,#d1ecfc,358577,#e3f3fd,417,#f3fafe,25,#f8fcff,5.995203836930456,#e1f2fd,119525.66666666667,#b5e0fb,78785,#eff8fe,26261.666666666668,#8ccef9,"Russia started their anti-US campaign in 2014&#44; long before I announced that I would run for President. The results of the election were not impacted. The Trump campaign did nothing wrong - no collusion!",964594780088033282,2018-02-16 09:18
2018-02-01,17,7,#eaf6fe,0,#ffffff,7,#eaf6fe,118119,#dff1fd,25523,#e0f2fd,601997,#cfebfc,1104,#def1fd,78,#eaf6fe,7.065217391304348,#dbf0fd,85999.57142857143,#c9e8fc,141661,#e2f3fd,20237.285714285714,#a7d9fa,"Our entire Nation&#44; w/one heavy heart&#44; continues to pray for the victims &amp; their families in Parkland&#44; FL. To teachers&#44; law enforcement&#44; first responders &amp; medical professionals who responded so bravely in the face of danger: We THANK YOU for your courage! https://t.co/3yJsrebZMG https://t.co/ti791dENTy",964724390637244417,2018-02-17 05:53
2018-02-01,18,13,#d7eefd,1,#f9fdff,12,#daeffd,149114,#d7eefd,38387,#cfebfc,1291587,#99d3f9,2102,#bfe4fb,158,#d3edfc,7.516650808753568,#d9effd,99352.84615384616,#c0e5fb,335463,#b9e2fb,25804.846153846152,#8ecff9,"Very sad that the FBI missed all of the many signals sent out by the Florida school shooter. This is not acceptable. They are spending too much time trying to prove Russian collusion with the Trump campaign - there is no collusion. Get back to the basics and make us all proud!",965075589274177536,2018-02-18 05:08
2018-02-01,19,3,#f6fbfe,0,#ffffff,3,#f6fbfe,153608,#d5edfc,34437,#d4edfc,389212,#e0f2fd,330,#f5fbfe,16,#fbfdff,4.848484848484849,#e6f5fe,129737.33333333333,#afddfa,80599,#eff8fe,26866.333333333332,#89cdf9,"Just watched a very insecure Oprah Winfrey&#44; who at one point I knew very well&#44; interview a panel of people on 60 Minutes. The questions were biased and slanted&#44; the facts incorrect. Hope Oprah runs so she can be exposed and defeated just like all of the others!",965442990134251520,2018-02-19 05:28
2018-02-01,20,13,#d7eefd,0,#ffffff,13,#d7eefd,120633,#def1fd,25306,#e0f2fd,1004515,#afddfa,2210,#bce3fb,154,#d5edfc,6.968325791855204,#dbf0fd,77270.38461538461,#cfebfc,223349,#d1ecfc,17180.69230769231,#b3dffb,"The U.S. economy is looking very good&#44; in my opinion&#44; even better than anticipated. Companies are pouring back into our country&#44; reversing the long term trend of leaving. The unemployment numbers are looking great&#44; and Regulations &amp; Taxes have been massively Cut! JOBS&#44; JOBS&#44; JOBS",965775382598311937,2018-02-20 03:29
2018-02-01,21,8,#e7f5fe,0,#ffffff,8,#e7f5fe,150289,#d6eefd,32325,#d7eefd,719616,#c5e7fb,1243,#daeffd,90,#e6f5fe,7.240547063555913,#daeffd,89952,#c7e7fc,161983,#def1fd,20247.875,#a7d9fa,"The GREAT Billy Graham is dead. There was nobody like him! He will be missed by Christians and all religions. A very special man.",966317112565420033,2018-02-21 03:22
2018-02-01,22,10,#e0f2fd,0,#ffffff,10,#e0f2fd,185614,#cceafc,36750,#d2ecfc,1098311,#a8dafa,1860,#c7e7fc,159,#d3edfc,8.548387096774194,#d3edfc,109831.1,#bae2fb,239733,#cdeafc,23973.3,#97d3f9,"I will be strongly pushing Comprehensive Background Checks with an emphasis on Mental Health. Raise age to 21 and end sale of Bump Stocks! Congress is in a mood to finally do something on this issue - I hope!",966662241977360384,2018-02-22 02:13
2018-02-01,23,10,#e0f2fd,0,#ffffff,10,#e0f2fd,125750,#ddf1fd,32011,#d8eefd,850041,#bae2fb,1234,#daeffd,139,#d9effd,11.26418152350081,#c5e7fb,85004.1,#cae9fc,187313,#d8effd,18731.3,#addcfa,"MS-13 gang members are being removed by our Great ICE and Border Patrol Agents by the thousands&#44; but these killers come back in from El Salvador&#44; and through Mexico&#44; like water. El Salvador just takes our money&#44; and Mexico must help MORE with this problem. We need The Wall!",966998215592677376,2018-02-23 12:28
2018-02-01,24,7,#eaf6fe,1,#f9fdff,6,#edf7fe,99968,#e4f4fd,37160,#d1ecfc,517522,#d6eefc,916,#e4f3fd,118,#dff1fd,12.882096069868995,#bce3fb,73931.71428571429,#d1ecfc,165671,#ddf1fd,23667.285714285714,#98d3f9,"BIG CPAC STRAW POLL RESULTS: 93% APPROVE OF THE JOB PRESIDENT TRUMP IS DOING (Thank you!). 50% say President Trump should Tweet MORE or SAME (funny!). 79% say Republicans in Congress should do a better job of working with President Trump (starting to happen).",967526110249537542,2018-02-24 11:26
2018-02-01,25,9,#e3f3fd,4,#e8f5fe,5,#f0f8fe,83203,#e9f5fe,21940,#e4f4fd,365285,#e2f3fd,501,#f0f9fe,52,#f1f9fe,10.379241516966069,#c9e9fc,40587.22222222222,#e6f4fd,140727,#e2f3fd,15636.333333333334,#bae2fb,"The Democrat memo response on government surveillance abuses is a total political and legal BUST. Just confirms all of the terrible things that were done. SO ILLEGAL!",967538684789739520,2018-02-25 12:16
2018-02-01,26,0,#ffffff,0,#ffffff,0,#ffffff,,#ffffff,,#ffffff,0,#ffffff,0,#ffffff,0,#ffffff,,#ffffff,,#ffffff,0,#ffffff,,#ffffff,"",,2018-02-26 12:00
2018-02-01,27,8,#e7f5fe,0,#ffffff,8,#e7f5fe,106481,#e2f3fd,29452,#dbf0fd,602597,#cfebfc,1321,#d7eefd,114,#e0f2fd,8.629825889477669,#d3ecfc,75324.625,#d0ebfc,153226,#e0f2fd,19153.25,#abdbfa,"I want to encourage all of my many Texas friends to vote in the primary for Governor Greg Abbott&#44; Senator Ted Cruz&#44; Lt. Gov. Dan Patrick&#44; and Attorney General Ken Paxton. They are helping me to Make America Great Again! Vote early or on March 6th.",968549117625602054,2018-02-27 07:11
2018-02-01,28,10,#e0f2fd,0,#ffffff,10,#e0f2fd,112466,#e1f2fd,25454,#e0f2fd,839764,#bbe3fb,1714,#cbe9fc,145,#d7eefd,8.459743290548424,#d4edfc,83976.4,#cae9fc,194512,#d7eefd,19451.2,#aadbfa,"45 year low on illegal border crossings this year. Ice and Border Patrol Agents are doing a great job for our Country. MS-13 thugs being hit hard.",968850364383596545,2018-02-28 03:08
2018-03-01,1,6,#edf7fe,0,#ffffff,6,#edf7fe,103843,#e3f3fd,22787,#e3f3fd,390520,#e0f2fd,822,#e7f5fe,64,#eef8fe,7.785888077858881,#d7eefd,65086.666666666664,#d7eefd,89162,#edf7fe,14860.333333333334,#bde3fb,"Our Steel and Aluminum industries (and many others) have been decimated by decades of unfair trade and bad policy with countries from around the world. We must not let our country&#44; companies and workers be taken advantage of any longer. We want free&#44; fair and SMART TRADE!",969183644756660224,2018-03-01 01:12
2018-03-01,2,13,#d7eefd,2,#f4fafe,11,#ddf1fd,141272,#d9effd,31087,#d9effd,897595,#b7e1fb,1185,#dcf0fd,135,#daeffd,11.39240506329114,#c4e6fb,69045.76923076923,#d4edfc,206140,#d4edfc,15856.923076923076,#b9e2fb,"Alec Baldwin&#44; whose dying mediocre career was saved by his terrible impersonation of me on SNL&#44; now says playing me was agony. Alec&#44; it was agony for those who were forced to watch. Bring back Darrell Hammond&#44; funnier and a far greater talent!",969529668234829825,2018-03-02 12:07
2018-03-01,3,4,#f3fafe,0,#ffffff,4,#f3fafe,130205,#dcf0fd,31042,#d9effd,424324,#ddf1fd,519,#f0f8fe,36,#f5fbfe,6.936416184971098,#dcf0fd,106081,#bce3fb,104398,#eaf6fe,26099.5,#8dcff9,"The United States has an $800 Billion Dollar Yearly Trade Deficit because of our “very stupid” trade deals and policies. Our jobs and wealth are being given to other countries that have taken advantage of us for years. They laugh at what fools our leaders have been. No more!",969991653393039361,2018-03-03 06:43
2018-03-01,4,1,#fcfeff,0,#ffffff,1,#fcfeff,102246,#e3f3fd,19948,#e7f5fe,102246,#f7fcff,153,#fafdff,7,#fdfeff,4.57516339869281,#e8f5fe,102246,#bee4fb,19948,#fbfdff,19948,#a8dafa,"The Gridiron Dinner last night was great fun. I am accomplishing a lot in Washington and have never had a better time doing something&#44; and especially since this is for the American People!",970353692938469377,2018-03-04 06:42
2018-03-01,5,6,#edf7fe,0,#ffffff,6,#edf7fe,131365,#dbf0fd,39150,#ceebfc,615403,#ceeafc,963,#e2f3fd,106,#e2f3fd,11.007268951194185,#c6e7fc,102567.16666666667,#bee4fb,150621,#e0f2fd,25103.5,#91d0f9,"Why did the Obama Administration start an investigation into the Trump Campaign (with zero proof of wrongdoing) long before the Election in November? Wanted to discredit so Crooked H would win. Unprecedented. Bigger than Watergate! Plus&#44; Obama did NOTHING about Russian meddling.",970650759091163137,2018-03-05 02:22
2018-03-01,6,8,#e7f5fe,1,#f9fdff,7,#eaf6fe,213557,#c4e7fb,59495,#b5e0fb,684378,#c8e8fc,784,#e8f5fe,62,#eef8fe,7.908163265306122,#d7eefd,85547.25,#c9e9fc,189736,#d8eefd,23717,#98d3f9,"Lowest rated Oscars in HISTORY. Problem is&#44; we don’t have Stars anymore - except your President (just kidding&#44; of course)!",971013841395027968,2018-03-06 02:25
2018-03-01,7,6,#edf7fe,0,#ffffff,6,#edf7fe,128219,#dcf0fd,35446,#d3edfc,438002,#dcf0fd,878,#e5f4fd,71,#ecf7fe,8.086560364464692,#d6eefc,73000.33333333333,#d2ecfc,98875,#ebf6fe,16479.166666666668,#b6e0fb,"From Bush 1 to present&#44; our Country has lost more than 55&#44;000 factories&#44; 6&#44;000&#44;000 manufacturing jobs and accumulated Trade Deficits of more than 12 Trillion Dollars. Last year we had a Trade Deficit of almost 800 Billion Dollars. Bad Policies &amp; Leadership. Must WIN again!  #MAGA",971349864125788160,2018-03-07 12:40
2018-03-01,8,5,#f0f8fe,0,#ffffff,5,#f0f8fe,92589,#e6f4fd,18981,#e8f5fe,295728,#e8f5fe,538,#eff8fe,48,#f2f9fe,8.921933085501859,#d1ecfc,59145.6,#daeffd,61735,#f2fafe,12347,#c8e8fc,"Looking forward to 3:30 P.M. meeting today at the White House. We have to protect &amp; build our Steel and Aluminum Industries while at the same time showing great flexibility and cooperation toward those that are real friends  and treat us fairly on both trade and the military.",971726862526361603,2018-03-08 01:38
2018-03-01,9,5,#f0f8fe,0,#ffffff,5,#f0f8fe,173271,#d0ebfc,45093,#c7e7fc,431829,#ddf0fd,714,#eaf6fe,81,#e9f6fe,11.344537815126051,#c4e6fb,86365.8,#c9e8fc,105923,#e9f6fe,21184.6,#a3d8fa,"Kim Jong Un talked about denuclearization with the South Korean Representatives&#44; not just a freeze. Also&#44; no missile testing by North Korea during this period of time. Great progress being made but sanctions will remain until an agreement is reached. Meeting being planned!",971915531346436096,2018-03-09 02:08
2018-03-01,10,10,#e0f2fd,0,#ffffff,10,#e0f2fd,125797,#ddf1fd,26834,#def1fd,820382,#bde3fb,1803,#c8e8fc,142,#d8eefd,7.875762617859124,#d7eefd,82038.2,#cce9fc,178545,#daeffd,17854.5,#b1defa,"The deal with North Korea is very much in the making and will be&#44; if completed&#44; a very good one for the World. Time and place to be determined.",972271520847466498,2018-03-10 01:42
2018-03-01,11,7,#eaf6fe,0,#ffffff,7,#eaf6fe,106270,#e2f3fd,24923,#e0f2fd,569324,#d1ecfc,1223,#daeffd,124,#ddf1fd,10.139002452984464,#cbe9fc,81332,#cceafc,135288,#e3f3fd,19326.85714285714,#abdbfa,"Rasmussen and others have my approval ratings at around 50%&#44; which is higher than Obama&#44; and yet the political pundits love saying my approval ratings are “somewhat low.” They know they are lying when they say it. Turn off the show - FAKE NEWS!",972853747750711296,2018-03-11 04:16
2018-03-01,12,6,#edf7fe,0,#ffffff,6,#edf7fe,81658,#e9f6fe,18503,#e8f5fe,410696,#def1fd,1009,#e1f2fd,58,#eff8fe,5.7482656095143705,#e2f3fd,68449.33333333333,#d4edfc,89686,#edf7fe,14947.666666666666,#bde3fb,"Very strong improvement and strengthening of background checks will be fully backed by White House. Legislation moving forward. Bump Stocks will soon be out. Highly trained expert teachers will be allowed to conceal carry&#44; subject to State Law. Armed guards OK&#44; deterrent!.......",973185831547670529,2018-03-12 02:15
2018-03-01,13,7,#eaf6fe,0,#ffffff,7,#eaf6fe,161082,#d3edfc,44798,#c7e8fc,737348,#c3e6fb,1137,#ddf1fd,245,#bbe3fb,21.54793315743184,#91d0f9,105335.42857142857,#bde3fb,198732,#d6eefc,28390.285714285714,#82caf8,"THE HOUSE INTELLIGENCE COMMITTEE HAS&#44; AFTER A 14 MONTH LONG IN-DEPTH INVESTIGATION&#44; FOUND NO EVIDENCE OF COLLUSION OR COORDINATION BETWEEN THE TRUMP CAMPAIGN AND RUSSIA TO INFLUENCE THE 2016 PRESIDENTIAL ELECTION.",973360355790479361,2018-03-13 01:49
2018-03-01,14,10,#e0f2fd,0,#ffffff,10,#e0f2fd,93275,#e6f4fd,25961,#dff1fd,676270,#c9e8fc,1361,#d6eefd,138,#d9effd,10.139603232916972,#cbe9fc,67627,#d5edfc,148118,#e1f2fd,14811.8,#bde4fb,"Today the House took major steps toward securing our schools by passing the STOP School Violence Act. We must put the safety of America's children FIRST by improving training and by giving schools and law enforcement better tools. A tragedy like Parkland can't happen ever again!",974033924493111296,2018-03-14 10:25
2018-03-01,15,6,#edf7fe,1,#f9fdff,5,#f0f8fe,81249,#e9f6fe,17466,#eaf6fe,356267,#e3f3fd,758,#e8f5fe,58,#eff8fe,7.651715039577836,#d8eefd,59377.833333333336,#daeffd,83544,#eef8fe,13924,#c1e5fb,"Larry Kudlow will be my Chief Economic Advisor as Director of the National Economic Council. Our Country will have many years of Great Economic &amp; Financial Success&#44; with low taxes&#44; unparalleled innovation&#44; fair trade and an ever expanding labor force leading the way! #MAGA",974241711315709954,2018-03-15 12:11
2018-03-01,16,5,#f0f8fe,0,#ffffff,5,#f0f8fe,114201,#e0f2fd,21791,#e4f4fd,419248,#def1fd,647,#ecf7fe,46,#f3fafe,7.109737248840804,#dbf0fd,83849.6,#cbe9fc,84500,#eef8fe,16900,#b5e0fb,"Our thoughts and prayers go out to the families and loved ones of the brave troops lost in the helicopter crash on the Iraq-Syria border yesterday. Their sacrifice in service to our country will never be forgotten.",974656757187440640,2018-03-16 03:40
2018-03-01,17,4,#f3fafe,0,#ffffff,4,#f3fafe,165233,#d2ecfc,47996,#c3e6fb,518836,#d6edfc,672,#ebf6fe,55,#f0f9fe,8.18452380952381,#d5edfc,129709,#afddfa,136343,#e3f3fd,34085.75,#6cc0f7,"Andrew McCabe FIRED&#44; a great day for the hard working men and women of the FBI - A great day for Democracy. Sanctimonious James Comey was his boss and made McCabe look like a choirboy. He knew all about the lies and corruption going on at the highest levels of the FBI!",974859881827258369,2018-03-17 05:08
2018-03-01,18,4,#f3fafe,0,#ffffff,4,#f3fafe,130172,#dcf0fd,33419,#d6eefc,462799,#daeffd,742,#e9f6fe,66,#edf7fe,8.89487870619946,#d1ecfc,115699.75,#b7e1fb,122075,#e6f4fd,30518.75,#79c6f8,"Spent very little time with Andrew McCabe&#44; but he never took notes when he was with me. I don’t believe he made memos except to help his own agenda&#44; probably at a later date. Same with lying James Comey. Can we call them Fake Memos?",975346628113596417,2018-03-18 01:22
2018-03-01,19,3,#f6fbfe,1,#f9fdff,2,#f9fcff,111018,#e1f2fd,24770,#e1f2fd,161119,#f2fafe,81,#fdfeff,13,#fbfdff,16.049382716049383,#addcfa,53706.333333333336,#def1fd,44794,#f6fbfe,14931.333333333334,#bde3fb,"A total WITCH HUNT with massive conflicts of interest!",975720503997620224,2018-03-19 02:07
2018-03-01,20,2,#f9fcff,0,#ffffff,2,#f9fcff,140902,#d9effd,33993,#d5edfc,240132,#ecf7fe,234,#f8fcff,30,#f7fcff,12.820512820512821,#bce3fb,120066,#b4dffb,55996,#f4fafe,27998,#84cbf8,"Our Nation was founded by farmers. Our independence was won by farmers. And our continent was tamed by farmers. Our farmers always lead the way -- we are PROUD of them&#44; and we are DELIVERING for them! #NationalAgricultureDay",976120272435793920,2018-03-20 04:36
2018-03-01,21,7,#eaf6fe,0,#ffffff,7,#eaf6fe,137016,#daeffd,29872,#daeffd,582816,#d0ebfc,1216,#dbf0fd,120,#def1fd,9.868421052631579,#cceafc,83259.42857142857,#cbe9fc,132148,#e4f3fd,18878.285714285714,#acdcfa,"AUSTIN BOMBING SUSPECT IS DEAD. Great job by law enforcement and all concerned!",976405122757558272,2018-03-21 11:28
2018-03-01,22,8,#e7f5fe,1,#f9fdff,7,#eaf6fe,258162,#b8e1fb,75713,#a2d7fa,758965,#c2e5fb,1176,#dcf0fd,58,#eff8fe,4.931972789115647,#e6f4fd,94870.625,#c3e6fb,212267,#d3ecfc,26533.375,#8bcef9,"Crazy Joe Biden is trying to act like a tough guy. Actually&#44; he is weak&#44; both mentally and physically&#44; and yet he threatens me&#44; for the second time&#44; with physical assault. He doesn’t know me&#44; but he would go down fast and hard&#44; crying all the way. Don’t threaten people Joe!",976765417908776963,2018-03-22 11:19
2018-03-01,23,5,#f0f8fe,0,#ffffff,5,#f0f8fe,155673,#d5edfc,37288,#d1ecfc,435631,#dcf0fd,797,#e7f5fe,90,#e6f5fe,11.292346298619824,#c5e7fb,87126.2,#c8e8fc,101593,#eaf6fe,20318.6,#a6d9fa,"I am considering a VETO of the Omnibus Spending Bill based on the fact that the 800&#44;000 plus DACA recipients have been totally abandoned by the Democrats (not even mentioned in Bill) and the BORDER WALL&#44; which is desperately needed for our National Defense&#44; is not fully funded.",977166887493799936,2018-03-23 01:55
2018-03-01,24,2,#f9fcff,0,#ffffff,2,#f9fcff,83062,#e9f5fe,19345,#e7f5fe,154460,#f3fafe,426,#f2fafe,24,#f9fcff,5.633802816901408,#e2f3fd,77230,#cfebfc,35105,#f8fcff,17552.5,#b2defa,"Our thoughts and prayers are with the victims of the horrible attack in France yesterday&#44; and we grieve the nation’s loss. We also condemn the violent actions of the attacker and anyone who would provide him support. We are with you @EmmanuelMacron!",977585879651966980,2018-03-24 05:40
2018-03-01,25,7,#eaf6fe,0,#ffffff,7,#eaf6fe,117696,#dff1fd,31170,#d9effd,546842,#d3edfc,1195,#dbf0fd,93,#e6f4fd,7.7824267782426775,#d7eefd,78120.28571428571,#ceebfc,129175,#e5f4fd,18453.571428571428,#aeddfa,"Because of the $700 &amp; $716 Billion Dollars gotten to rebuild our Military&#44; many jobs are created and our Military is again rich. Building a great Border Wall&#44; with drugs (poison) and enemy combatants pouring into our Country&#44; is all about National Defense. Build WALL through M!",977855968364171264,2018-03-25 12:33
2018-03-01,26,4,#f3fafe,0,#ffffff,4,#f3fafe,133788,#dbf0fd,27436,#ddf1fd,376902,#e1f2fd,459,#f1f9fe,30,#f7fcff,6.5359477124183005,#def1fd,94225.5,#c4e6fb,83578,#eef8fe,20894.5,#a4d8fa,"So much Fake News. Never been more voluminous or more inaccurate. But through it all&#44; our country is doing great!",978249938743234560,2018-03-26 02:38
2018-03-01,27,3,#f6fbfe,1,#f9fdff,2,#f9fcff,104664,#e3f3fd,31171,#d9effd,172793,#f1f9fe,292,#f6fbfe,10,#fcfeff,3.4246575342465753,#eef8fe,57597.666666666664,#dbf0fd,67748,#f1f9fe,22582.666666666668,#9dd5f9,"Trade talks going on with numerous countries that&#44; for many years&#44; have not treated the United States fairly. In the end&#44; all will be happy!",978432632273948674,2018-03-27 02:44
2018-03-01,28,9,#e3f3fd,0,#ffffff,9,#e3f3fd,194123,#cae9fc,59143,#b6e0fb,891753,#b7e1fb,1373,#d6eefc,160,#d3ecfc,11.653313911143481,#c3e6fb,99083.66666666667,#c1e5fb,223046,#d1ecfc,24782.88888888889,#93d1f9,"THE SECOND AMENDMENT WILL NEVER BE REPEALED! As much as Democrats would like to see this happen&#44; and despite the words yesterday of former Supreme Court Justice Stevens&#44; NO WAY. We need more Republicans in 2018 and must ALWAYS hold the Supreme Court!",978932860307505153,2018-03-28 11:52
2018-03-01,29,4,#f3fafe,0,#ffffff,4,#f3fafe,130541,#dcf0fd,33388,#d6eefc,385470,#e0f2fd,733,#e9f6fe,73,#ebf7fe,9.959072305593452,#cce9fc,96367.5,#c2e6fb,95370,#ecf7fe,23842.5,#97d3f9,"I have stated my concerns with Amazon long before the Election. Unlike others&#44; they pay little or no taxes to state &amp; local governments&#44; use our Postal System as their Delivery Boy (causing tremendous loss to the U.S.)&#44; and are putting many thousands of retailers out of business!",979326715272065024,2018-03-29 01:57
2018-03-01,30,1,#fcfeff,0,#ffffff,1,#fcfeff,88218,#e7f5fe,25486,#e0f2fd,88218,#f8fcff,0,#ffffff,0,#ffffff,,#ffffff,88218,#c8e8fc,25486,#fafdff,25486,#90d0f9,"https://t.co/UM3YJ6lUiD",979816766904954880,2018-03-30 10:24
2018-03-01,31,3,#f6fbfe,0,#ffffff,3,#f6fbfe,98367,#e5f4fd,32577,#d7eefd,270676,#eaf6fe,631,#ecf7fe,46,#f3fafe,7.290015847860539,#daeffd,90225.33333333333,#c6e7fc,76844,#eff8fe,25614.666666666668,#8fd0f9,"Governor Jerry “Moonbeam” Brown pardoned 5 criminal illegal aliens whose crimes include (1) Kidnapping and Robbery (2) Badly beating wife and threatening a crime with intent to terrorize (3) Dealing drugs. Is this really what the great people of California want? @FoxNews",980065427375128576,2018-03-31 02:53
2018-04-01,1,4,#f3fafe,0,#ffffff,4,#f3fafe,209522,#c6e7fb,41508,#cbe9fc,554641,#d3ecfc,519,#f0f8fe,75,#ebf6fe,14.45086705202312,#b5e0fb,138660.25,#a9dbfa,132356,#e4f3fd,33089,#70c2f7,"HAPPY EASTER!",980421275326865409,2018-04-01 02:27
2018-04-01,2,9,#e3f3fd,0,#ffffff,9,#e3f3fd,90936,#e7f5fe,23709,#e2f3fd,682482,#c8e8fc,1478,#d3ecfc,114,#e0f2fd,7.713125845737483,#d8eefd,75831.33333333333,#d0ebfc,168142,#dcf0fd,18682.444444444445,#addcfa,"DACA is dead because the Democrats didn’t care or act&#44; and now everyone wants to get onto the DACA bandwagon... No longer works. Must build Wall and secure our borders with proper Border legislation. Democrats want No Borders&#44; hence drugs and crime!",980766121983987712,2018-04-02 01:17
2018-04-01,3,13,#d7eefd,0,#ffffff,13,#d7eefd,109584,#e1f2fd,30648,#d9effd,1119301,#a6d9fa,2277,#bae2fb,226,#c0e5fb,9.925340360122968,#cceafc,86100.07692307692,#c9e8fc,270461,#c7e7fc,20804.69230769231,#a4d8fa,"Was just briefed on the shooting at YouTube’s HQ in San Bruno&#44; California. Our thoughts and prayers are with everybody involved. Thank you to our phenomenal Law Enforcement Officers and First Responders that are currently on the scene.",981287536520847360,2018-04-03 11:49
2018-04-01,4,5,#f0f8fe,0,#ffffff,5,#f0f8fe,144378,#d8eefd,37281,#d1ecfc,494483,#d8eefd,799,#e7f5fe,66,#edf7fe,8.260325406758447,#d5edfc,98896.6,#c1e5fb,117334,#e7f5fe,23466.8,#99d4f9,"We are not in a trade war with China&#44; that war was lost many years ago by the foolish&#44; or incompetent&#44; people who represented the U.S. Now we have a Trade Deficit of $500 Billion a year&#44; with Intellectual Property Theft of another $300 Billion. We cannot let this continue!",981492087328792577,2018-04-04 01:22
2018-04-01,5,5,#f0f8fe,0,#ffffff,5,#f0f8fe,99983,#e4f4fd,24732,#e1f2fd,407569,#dff1fd,735,#e9f6fe,90,#e6f5fe,12.244897959183673,#bfe5fb,81513.8,#cceafc,95773,#ebf7fe,19154.6,#abdbfa,"“Still Rising: Rasmussen Poll Shows Donald Trump Approval Ratings Now at 51 Percent” https://t.co/q80PaE0gQo",981669823221559302,2018-04-05 01:08
2018-04-01,6,7,#eaf6fe,1,#f9fdff,6,#edf7fe,97151,#e5f4fd,37272,#d1ecfc,475764,#d9effd,752,#e9f5fe,90,#e6f5fe,11.96808510638298,#c1e5fb,67966.28571428571,#d5edfc,158625,#def1fd,22660.714285714286,#9cd5f9,"“BET founder: Trump's economy is bringing black workers back into the labor force” https://t.co/TtMDfi4bv0",982353242196766720,2018-04-06 10:23
2018-04-01,7,5,#f0f8fe,0,#ffffff,5,#f0f8fe,107845,#e2f3fd,26680,#def1fd,465454,#daeffd,847,#e6f4fd,99,#e4f3fd,11.688311688311689,#c2e6fb,93090.8,#c5e7fb,114159,#e8f5fe,22831.8,#9cd5f9,"We are sealing up our Southern Border. The people of our great country want Safety and Security. The Dems have been a disaster on this very important issue!",982682227581636608,2018-04-07 08:11
2018-04-01,8,9,#e3f3fd,0,#ffffff,9,#e3f3fd,136189,#daeffd,33180,#d6eefd,743284,#c3e6fb,1572,#d0ebfc,106,#e2f3fd,6.743002544529262,#ddf0fd,82587.11111111111,#cbe9fc,182764,#d9effd,20307.11111111111,#a6d9fa,"Fire at Trump Tower is out. Very confined (well built building). Firemen (and women) did a great job. THANK YOU!",982750459877380096,2018-04-08 12:42
