month,day,total,total-color,retweets,retweets-color,original,original-color,highestLikes,highestLikes-color,highestRetweets,highestRetweets-color,totalLikes,totalLikes-color,letters,letters-color,capitalLetters,capitalLetters-color,loudness,loudness-color,likeRate,likeRate-color,totalRetweets,totalRetweets-color,retweetRate,retweetRate-color,most-popular-text,most-popular-id,most-popular-date
2018-11-01,23,4,#f3fafe,0,#ffffff,4,#f3fafe,163397,#d3ecfc,38114,#d0ebfc,392638,#e0f2fd,843,#e6f4fd,51,#f1f9fe,6.049822064056939,#e0f2fd,98159.5,#c1e5fb,92614,#ecf7fe,23153.5,#9ad4f9,"Republicans and Democrats MUST come together&#44; finally&#44; with a major Border Security package&#44; which will include funding for the Wall. After 40 years of talk&#44; it is finally time for action. Fix the Border&#44; for once and for all&#44; NOW!",1065948536498544640,2018-11-23 01:41
2018-11-01,24,3,#f6fbfe,2,#f4fafe,1,#fcfeff,90763,#e7f5fe,51826,#bee4fb,90763,#f8fcff,221,#f8fcff,17,#fafdff,7.6923076923076925,#d8eefd,30254.333333333332,#ecf7fe,80064,#eff8fe,26688,#8acef9,"I am extremely happy and proud of the job being done by @USTreasury Secretary @StevenMnuchin1. The FAKE NEWS likes to write stories to the contrary&#44; quoting phony sources or jealous people&#44; but they aren’t true. They never like to ask me for a quote b/c it would kill their story.",1066116263649382400,2018-11-24 12:48
2018-11-01,25,11,#ddf1fd,0,#ffffff,11,#ddf1fd,166298,#d2ecfc,38100,#d0ebfc,1117970,#a6d9fa,2080,#c0e5fb,148,#d6eefd,7.115384615384615,#dbf0fd,101633.63636363637,#bfe4fb,272518,#c6e7fc,24774.363636363636,#93d1f9,"Migrants at the Southern Border will not be allowed into the United States until their claims are individually approved in court. We only will allow those who come into our Country legally. Other than that our very strong policy is Catch and Detain. No “Releasing” into the U.S...",1066478927143677952,2018-11-25 12:49
2018-11-01,26,10,#e0f2fd,0,#ffffff,10,#e0f2fd,174087,#d0ebfc,45629,#c6e7fc,946585,#b3dffa,1828,#c8e8fc,96,#e5f4fd,5.25164113785558,#e4f4fd,94658.5,#c4e6fb,242453,#cdeafc,24245.3,#95d2f9,"Mexico should move the flag waving Migrants&#44; many of whom are stone cold criminals&#44; back to their countries. Do it by plane&#44; do it by bus&#44; do it anyway you want&#44; but they are NOT coming into the U.S.A. We will close the Border permanently if need be. Congress&#44; fund the WALL!",1067015026995879937,2018-11-26 12:19
2018-11-01,27,9,#e3f3fd,3,#eef8fe,6,#edf7fe,124746,#ddf1fd,31187,#d9effd,596598,#cfebfc,1095,#def1fd,101,#e3f3fd,9.223744292237443,#d0ebfc,66288.66666666667,#d6eefc,184990,#d9effd,20554.444444444445,#a5d9fa,"Very disappointed with General Motors and their CEO&#44; Mary Barra&#44; for closing plants in Ohio&#44; Michigan and Maryland. Nothing being closed in Mexico &amp; China. The U.S. saved General Motors&#44; and this is the THANKS we get! We are now looking at cutting all @GM subsidies&#44; including....",1067494680416407552,2018-11-27 08:05
2018-11-01,28,14,#d4edfc,7,#d7eefd,7,#eaf6fe,114488,#e0f2fd,43379,#c9e8fc,666761,#c9e9fc,1339,#d7eefd,105,#e2f3fd,7.8416728902165795,#d7eefd,47625.78571428572,#e2f2fd,334682,#b9e2fb,23905.85714285714,#97d3f9,"Steel Dynamics announced that it will build a brand new 3 million ton steel mill in the Southwest that will create 600 good-paying U.S. JOBS. Steel JOBS are coming back to America&#44; just like I predicted. Congratulations to Steel Dynamics!",1067812811068383232,2018-11-28 05:09
2018-11-01,29,15,#d1ebfc,0,#ffffff,15,#d1ebfc,125182,#ddf1fd,29737,#daeffd,1100035,#a8dafa,2332,#b8e1fb,182,#cdeafc,7.804459691252144,#d7eefd,73335.66666666667,#d1ecfc,262474,#c8e8fc,17498.266666666666,#b2dffa,"On behalf of @FLOTUS Melania and the entire Trump family&#44; I want to wish you all a very MERRY CHRISTMAS! May this Christmas Season bring peace to your hearts&#44; warmth to your homes&#44; cheer to your spirits and JOY TO THE WORLD! #NCTL2018🎄 https://t.co/XNMJQ5JDSU",1067924142316494848,2018-11-29 12:32
2018-11-01,30,11,#ddf1fd,0,#ffffff,11,#ddf1fd,156832,#d4edfc,31895,#d8eefd,960942,#b2dffa,1550,#d0ebfc,127,#dcf0fd,8.193548387096774,#d5edfc,87358.36363636363,#c8e8fc,212773,#d3ecfc,19343,#abdbfa,"Oh&#44; I get it! I am a very good developer&#44; happily living my life&#44; when I see our Country going in the wrong direction (to put it mildly). Against all odds&#44; I decide to run for President &amp; continue to run my business-very legal &amp; very cool&#44; talked about it on the campaign trail...",1068442531887632384,2018-11-30 10:52
2018-12-01,1,10,#e0f2fd,4,#e8f5fe,6,#edf7fe,216587,#c3e6fb,32754,#d7eefd,636669,#cceafc,671,#ebf6fe,51,#f1f9fe,7.600596125186289,#d8effd,63666.9,#d8eefd,155038,#dff1fd,15503.8,#bae2fb,"President George H.W. Bush led a long&#44; successful and beautiful life.  Whenever I was with him I saw his absolute joy for life and true pride in his family. His accomplishments were great from beginning to end. He was a truly wonderful man and will be missed by all!",1068826073775964160,2018-12-01 12:16
2018-12-01,2,1,#fcfeff,0,#ffffff,1,#fcfeff,75249,#ebf6fe,17277,#eaf6fe,75249,#f9fcff,125,#fbfdff,13,#fbfdff,10.4,#c9e9fc,75249,#d0ebfc,17277,#fbfdff,17277,#b3dffa,"This week&#44; Jews around the world will celebrate the miracles of Hanukkah. @FLOTUS Melania and I send our very best wishes for a blessed and Happy Hanukkah! https://t.co/LrnGcc86w4 https://t.co/Kdjeyvkzmb",1069324231333289991,2018-12-02 09:15
2018-12-01,3,12,#daeffd,0,#ffffff,12,#daeffd,141328,#d9effd,31945,#d8eefd,1111706,#a7d9fa,2061,#c0e5fb,154,#d5edfc,7.472100921882581,#d9effd,92642.16666666667,#c5e7fb,251432,#cbe9fc,20952.666666666668,#a4d8fa,"China has agreed to reduce and remove tariffs on cars coming into China from the U.S. Currently the tariff is 40%.",1069441198157455360,2018-12-03 05:00
2018-12-01,4,10,#e0f2fd,1,#f9fdff,9,#e3f3fd,122159,#def1fd,36409,#d2ecfc,821881,#bce3fb,1662,#cdeafc,120,#def1fd,7.2202166064981945,#daeffd,82188.1,#cce9fc,219384,#d2ecfc,21938.4,#9fd6fa,"....I am a Tariff Man. When people or countries come in to raid the great wealth of our Nation&#44; I want them to pay for the privilege of doing so. It will always be the best way to max out our economic power. We are right now taking in $billions in Tariffs. MAKE AMERICA RICH AGAIN",1069970500535902208,2018-12-04 04:03
2018-12-01,5,9,#e3f3fd,0,#ffffff,9,#e3f3fd,126149,#ddf1fd,18431,#e8f5fe,726997,#c4e6fb,1404,#d5edfc,73,#ebf7fe,5.199430199430199,#e5f4fd,80777.44444444444,#cdeafc,144524,#e1f2fd,16058.222222222223,#b8e1fb,"Looking forward to being with the Bush family. This is not a funeral&#44; this is a day of celebration for a great man who has led a long and distinguished life. He will be missed!",1070315986287583232,2018-12-05 02:56
2018-12-01,6,4,#f3fafe,0,#ffffff,4,#f3fafe,142221,#d8effd,29437,#dbf0fd,412257,#def1fd,639,#ecf7fe,40,#f4fafe,6.259780907668231,#dff1fd,103064.25,#bee4fb,86046,#edf7fe,21511.5,#a1d7fa,"Working hard&#44; thank you! https://t.co/3SoWTkZjP6",1070521302652469248,2018-12-06 04:32
2018-12-01,7,22,#bae2fb,1,#f9fdff,21,#bde4fb,145583,#d8eefd,39522,#ceeafc,1750412,#74c4f7,3692,#91d0f9,337,#a3d8fa,9.127843986998917,#d0ebfc,79564.18181818182,#cdeafc,436884,#a5d9fa,19858.363636363636,#a8dafa,"FAKE NEWS - THE ENEMY OF THE PEOPLE!",1070877666654519297,2018-12-07 04:08
2018-12-01,8,12,#daeffd,1,#f9fdff,11,#ddf1fd,151275,#d6eefc,39181,#ceebfc,1074681,#aadbfa,1545,#d0ebfc,156,#d4edfc,10.097087378640778,#cbe9fc,89556.75,#c7e8fc,258792,#c9e8fc,21566,#a1d7fa,"Very sad day &amp; night in Paris. Maybe it’s time to end the ridiculous and extremely expensive Paris Agreement and return money back to the people in the form of lower taxes? The U.S. was way ahead of the curve on that and the only major country where emissions went down last year!",1071454998414921728,2018-12-08 06:22
2018-12-01,9,5,#f0f8fe,0,#ffffff,5,#f0f8fe,141916,#d9effd,35672,#d3ecfc,595626,#cfebfc,784,#e8f5fe,62,#eef8fe,7.908163265306122,#d7eefd,119125.2,#b5e0fb,141056,#e2f3fd,28211.2,#83cbf8,"The Trump Administration has accomplished more than any other U.S. Administration in its first two (not even) years of existence&#44; &amp; we are having a great time doing it! All of this despite the Fake News Media&#44; which has gone totally out of its mind-truly the Enemy of the People!",1071898088267284482,2018-12-09 11:43
2018-12-01,10,3,#f6fbfe,0,#ffffff,3,#f6fbfe,104794,#e3f3fd,25245,#e0f2fd,293274,#e8f5fe,628,#ecf7fe,63,#eef8fe,10.031847133757962,#cbe9fc,97758,#c1e5fb,65521,#f2f9fe,21840.333333333332,#a0d7fa,"“Democrats can’t find a Smocking Gun tying the Trump campaign to Russia after James Comey’s testimony. No Smocking Gun...No Collusion.” @FoxNews  That’s because there was NO COLLUSION. So now the Dems go to a simple private transaction&#44; wrongly call it a campaign contribution&#44;...",1072095127894667265,2018-12-10 12:46
2018-12-01,11,13,#d7eefd,0,#ffffff,13,#d7eefd,119626,#dff1fd,28478,#dcf0fd,1165368,#a3d8fa,2257,#bbe2fb,161,#d3ecfc,7.133362871067789,#dbf0fd,89643.69230769231,#c7e7fc,266889,#c7e8fc,20529.923076923078,#a6d9fa,"....People do not yet realize how much of the Wall&#44; including really effective renovation&#44; has already been built. If the Democrats do not give us the votes to secure our Country&#44; the Military will build the remaining sections of the Wall. They know how important it is!",1072471575956504576,2018-12-11 01:42
2018-12-01,12,2,#f9fcff,0,#ffffff,2,#f9fcff,194346,#cae9fc,61295,#b3dffa,358415,#e3f3fd,254,#f8fcff,19,#fafdff,7.480314960629921,#d9effd,179207.5,#90d0f9,98081,#ebf6fe,49040.5,#32a5ef,"The Democrats and President Obama gave Iran 150 Billion Dollars and got nothing&#44; but they can’t give 5 Billion Dollars for National Security and a Wall?",1072836035514634240,2018-12-12 01:50
2018-12-01,13,14,#d4edfc,0,#ffffff,14,#d4edfc,128786,#dcf0fd,38771,#cfebfc,1049089,#acdcfa,1968,#c3e6fb,140,#d9effd,7.1138211382113825,#dbf0fd,74934.92857142857,#d0ebfc,242717,#cdeafc,17336.928571428572,#b3dffa,"Let’s not do a shutdown&#44; Democrats - do what’s right for the American People! https://t.co/bZg07ZKQqo",1073327086037741568,2018-12-13 10:21
2018-12-01,14,7,#eaf6fe,0,#ffffff,7,#eaf6fe,128368,#dcf0fd,27243,#def1fd,471026,#d9effd,1170,#dcf0fd,90,#e6f5fe,7.6923076923076925,#d8eefd,67289.42857142857,#d5edfc,98850,#ebf6fe,14121.42857142857,#c0e5fb,"China just announced that their economy is growing much slower than anticipated because of our Trade War with them. They have just suspended U.S. Tariff Hikes. U.S. is doing very well. China wants to make a big and very comprehensive deal. It could happen&#44; and rather soon!",1073617541476569088,2018-12-14 05:35
2018-12-01,15,8,#e7f5fe,0,#ffffff,8,#e7f5fe,143340,#d8effd,37948,#d0ebfc,834852,#bce3fb,1185,#dcf0fd,123,#ddf1fd,10.379746835443038,#c9e9fc,104356.5,#bde4fb,197919,#d6eefd,24739.875,#93d1f9,"Never in the history of our Country has the “press” been more dishonest than it is today. Stories that should be good&#44; are bad. Stories that should be bad&#44; are horrible. Many stories&#44; like with the REAL story on Russia&#44; Clinton &amp; the DNC&#44; seldom get reported. Too bad!",1073965319184678913,2018-12-15 04:37
2018-12-01,16,11,#ddf1fd,0,#ffffff,11,#ddf1fd,126329,#ddf0fd,32115,#d7eefd,922105,#b5e0fb,2433,#b6e0fb,165,#d2ecfc,6.781750924784217,#dcf0fd,83827.72727272728,#cbe9fc,237873,#ceeafc,21624.81818181818,#a1d7fa,"Remember&#44; Michael Cohen only became a “Rat” after the FBI did something which was absolutely unthinkable &amp; unheard of until the Witch Hunt was illegally started. They BROKE INTO AN ATTORNEY’S OFFICE! Why didn’t they break into the DNC to get the Server&#44; or Crooked’s office?",1074313153679450113,2018-12-16 03:39
2018-12-01,17,6,#edf7fe,1,#f9fdff,5,#f0f8fe,133258,#dbf0fd,32443,#d7eefd,499601,#d7eefd,1074,#dff1fd,60,#eff8fe,5.58659217877095,#e3f3fd,83266.83333333333,#cbe9fc,127294,#e5f4fd,21215.666666666668,#a3d8fa,"Anytime you hear a Democrat saying that you can have good Border Security without a Wall&#44; write them off as just another politician following the party line. Time for us to save billions of dollars a year and have&#44; at the same time&#44; far greater safety and control!",1074697102142382085,2018-12-17 05:05
2018-12-01,18,11,#ddf1fd,2,#f4fafe,9,#e3f3fd,96334,#e5f4fd,30271,#daeffd,673413,#c9e8fc,1723,#cbe9fc,145,#d7eefd,8.415554265815437,#d4edfc,61219.36363636364,#d9effd,215451,#d2ecfc,19586.454545454544,#aadbfa,"Facebook&#44; Twitter and Google are so biased toward the Dems it is ridiculous! Twitter&#44; in fact&#44; has made it much more difficult for people to join @realDonaldTrump. They have removed many names &amp; greatly slowed the level and speed of increase. They have acknowledged-done NOTHING!",1075004324567285761,2018-12-18 01:26
2018-12-01,19,12,#daeffd,0,#ffffff,12,#daeffd,116733,#dff2fd,25524,#e0f2fd,948482,#b3dffa,2159,#bde4fb,127,#dcf0fd,5.882352941176471,#e1f2fd,79040.16666666667,#ceeafc,216706,#d2ecfc,18058.833333333332,#b0defa,"We have defeated ISIS in Syria&#44; my only reason for being there during the Trump Presidency.",1075397797929775105,2018-12-19 03:29
2018-12-01,20,18,#c7e8fc,2,#f4fafe,16,#cdeafc,132284,#dbf0fd,36226,#d2ecfc,1463514,#8acef9,2812,#abdbfa,231,#bee4fb,8.214793741109531,#d5edfc,81306.33333333333,#cceafc,396514,#addcfa,22028.555555555555,#9fd6fa,"Farm Bill signing in 15 minutes! #Emmys #TBT https://t.co/KtSS17xvIn",1075846949427908608,2018-12-20 09:14
2018-12-01,21,19,#c4e6fb,0,#ffffff,19,#c4e6fb,138598,#d9effd,33445,#d6eefc,1740913,#75c4f7,2679,#afddfa,240,#bce3fb,8.958566629339305,#d1ecfc,91627,#c5e7fb,396247,#addcfa,20855.105263157893,#a4d8fa,"A design of our Steel Slat Barrier which is totally effective while at the same time beautiful! https://t.co/sGltXh0cu9",1076239448461987841,2018-12-21 11:14
2018-12-01,22,10,#e0f2fd,1,#f9fdff,9,#e3f3fd,175564,#cfebfc,40151,#cdeafc,1021671,#aeddfa,1143,#ddf0fd,111,#e1f2fd,9.711286089238845,#cdeafc,102167.1,#bfe4fb,236068,#ceeafc,23606.8,#98d3f9,"I won an election&#44; said to be one of the greatest of all time&#44; based on getting out of endless &amp; costly foreign wars &amp; also based on Strong Borders which will keep our Country safe. We fight for the borders of other countries&#44; but we won’t fight for the borders of our own!",1076575190899929088,2018-12-22 09:28
2018-12-01,23,12,#daeffd,0,#ffffff,12,#daeffd,153602,#d5edfc,33844,#d5edfc,1248612,#9cd5f9,2367,#b7e1fb,165,#d2ecfc,6.97084917617237,#dbf0fd,104051,#bde4fb,273799,#c6e7fb,22816.583333333332,#9cd5f9,"If anybody but your favorite President&#44; Donald J. Trump&#44; announced that&#44; after decimating ISIS in Syria&#44; we were going to bring our troops back home (happy &amp; healthy)&#44; that person would be the most popular hero in America. With me&#44; hit hard instead by the Fake News Media. Crazy!",1076658521926656000,2018-12-23 02:59
2018-12-01,24,18,#c7e8fc,1,#f9fdff,17,#cae9fc,182040,#cdeafc,41153,#cceafc,1991953,#63bcf6,3261,#9ed6f9,240,#bce3fb,7.359705611775529,#d9effd,110664.05555555556,#bae2fb,452009,#a2d8fa,25111.61111111111,#91d0f9,"I am in the Oval Office &amp; just gave out a 115 mile long contract for another large section of the Wall in Texas. We are already building and renovating many miles of Wall&#44; some complete. Democrats must end Shutdown and finish funding. Billions of Dollars&#44; &amp; lives&#44; will be saved!",1077329121745793025,2018-12-24 11:24
2018-12-01,25,2,#f9fcff,1,#f9fdff,1,#fcfeff,508327,#76c5f7,89254,#91d0f9,508327,#d6eefd,14,#ffffff,2,#feffff,14.285714285714286,#b6e0fb,254163.5,#64bcf6,113948,#e8f5fe,56974,#1e98e7,"Merry Christmas!",1077549301449060352,2018-12-25 01:59
2018-12-01,26,2,#f9fcff,0,#ffffff,2,#f9fcff,249842,#bae2fb,50441,#c0e5fb,472715,#d9effd,294,#f6fbfe,62,#eef8fe,21.08843537414966,#94d1f9,236357.5,#6ec1f7,97037,#ebf7fe,48518.5,#34a6ef,"I hope everyone&#44; even the Fake News Media&#44; is having a great Christmas! Our Country is doing very well. We are securing our Borders&#44; making great new Trade Deals&#44; and bringing our Troops Back Home. We are finally putting America First. MERRY CHRISTMAS!  #MAGA",1077705232665272321,2018-12-26 12:18
2018-12-01,27,11,#ddf1fd,0,#ffffff,11,#ddf1fd,179981,#ceeafc,45963,#c6e7fb,1129635,#a5d9fa,2071,#c0e5fb,138,#d9effd,6.663447609850314,#ddf1fd,102694.09090909091,#bee4fb,264145,#c8e8fc,24013.18181818182,#96d3f9,"I totally agree! https://t.co/KO8E3bfWfn",1078396200842395648,2018-12-27 10:04
2018-12-01,28,6,#edf7fe,0,#ffffff,6,#edf7fe,181435,#cdeafc,43772,#c9e8fc,828114,#bce3fb,1222,#daeffd,86,#e8f5fe,7.037643207855973,#dbf0fd,138019,#aadbfa,190052,#d8eefd,31675.333333333332,#75c4f7,"CNN &amp; others within the Fake News Universe were going wild about my signing MAGA hats for our military in Iraq and Germany. If these brave young people ask me to sign their hat&#44; I will sign. Can you imagine my saying NO? We brought or gave NO hats as the Fake News first reported!",1078431231262502912,2018-12-28 12:23
2018-12-01,29,7,#eaf6fe,0,#ffffff,7,#eaf6fe,144271,#d8eefd,34525,#d4edfc,885435,#b8e1fb,1463,#d3ecfc,136,#daeffd,9.295967190704033,#cfebfc,126490.71428571429,#b0defa,209668,#d4edfc,29952.571428571428,#7bc8f8,"For those that naively ask why didn’t the Republicans get approval to build the Wall over the last year&#44; it is because IN THE SENATE WE NEED 10 DEMOCRAT VOTES&#44; and they will gives us “NONE” for Border Security! Now we have to do it the hard way&#44; with a Shutdown. Too bad! @FoxNews",1079096156708319232,2018-12-29 08:25
2018-12-01,30,5,#f0f8fe,0,#ffffff,5,#f0f8fe,233299,#bfe4fb,61730,#b3dffa,755830,#c2e6fb,853,#e6f4fd,66,#edf7fe,7.737397420867526,#d7eefd,151166,#a2d7fa,195174,#d7eefd,39034.8,#57b7f5,"President and Mrs. Obama built/has a ten foot Wall around their D.C. mansion/compound. I agree&#44; totally necessary for their safety and security. The U.S. needs the same thing&#44; slightly larger version!",1079497288605683712,2018-12-30 10:59
2018-12-01,31,11,#ddf1fd,0,#ffffff,11,#ddf1fd,131151,#dcf0fd,30742,#d9effd,950265,#b3dffa,2145,#bee4fb,152,#d5edfc,7.086247086247086,#dbf0fd,86387.72727272728,#c9e8fc,221217,#d1ecfc,20110.636363636364,#a7dafa,"I’m in the Oval Office. Democrats&#44; come back from vacation now and give us the votes necessary for Border Security&#44; including the Wall. You voted yes in 2006 and 2013. One more yes&#44; but with me in office&#44; I’ll get it built&#44; and Fast!",1079763419908243456,2018-12-31 04:37
2019-01-01,1,19,#c4e6fb,0,#ffffff,19,#c4e6fb,277623,#b3dffb,59698,#b5e0fb,2021957,#60bbf6,2174,#bde3fb,410,#8fcff9,18.859245630174794,#9fd6fa,106418.78947368421,#bce3fb,511929,#96d2f9,26943.63157894737,#89cdf8,"Happy New Year!",1080107759755034624,2019-01-01 03:25
2019-01-01,2,5,#f0f8fe,0,#ffffff,5,#f0f8fe,175756,#cfebfc,36818,#d1ecfc,709217,#c6e7fb,965,#e2f3fd,82,#e9f5fe,8.49740932642487,#d3edfc,141843.4,#a7dafa,152553,#e0f2fd,30510.6,#79c7f8,"Here we go with Mitt Romney&#44; but so fast! Question will be&#44; is he a Flake?  I hope not. Would much prefer that Mitt focus on Border Security and so many other things where he can be helpful. I won big&#44; and he didn’t. He should be happy for all Republicans. Be a TEAM player &amp; WIN!",1080447092882112512,2019-01-02 01:53
2019-01-01,3,9,#e3f3fd,0,#ffffff,9,#e3f3fd,202291,#c8e8fc,54075,#bbe3fb,1091820,#a8dafa,1009,#e1f2fd,72,#ebf7fe,7.135777998017839,#dbf0fd,121313.33333333333,#b3dffb,261031,#c9e8fc,29003.444444444445,#7fc9f8,"https://t.co/JzfXMAPwKP",1080858959404240896,2019-01-03 05:10
2019-01-01,4,7,#eaf6fe,0,#ffffff,7,#eaf6fe,253468,#bae2fb,53530,#bce3fb,942401,#b4dffb,963,#e2f3fd,89,#e7f5fe,9.241952232606438,#d0ebfc,134628.7142857143,#acdcfa,196179,#d6eefd,28025.571428571428,#84cbf8,"How do you impeach a president who has won perhaps the greatest election of all time&#44; done nothing wrong (no Collusion with Russia&#44; it was the Dems that Colluded)&#44; had the most successful first two years of any president&#44; and is the most popular Republican in party history 93%?",1081177511592108032,2019-01-04 02:16
2019-01-01,5,12,#daeffd,0,#ffffff,12,#daeffd,135731,#daeffd,35133,#d4edfc,1247133,#9cd5f9,1934,#c4e6fb,133,#dbf0fd,6.87693898655636,#dcf0fd,103927.75,#bde4fb,275254,#c6e7fb,22937.833333333332,#9bd4f9,"Drug makers and companies are not living up to their commitments on pricing. Not being fair to the consumer&#44; or to our Country!",1081653927337213952,2019-01-05 09:49
2019-01-01,6,12,#daeffd,0,#ffffff,12,#daeffd,249935,#bae2fb,75590,#a2d8fa,1333009,#95d2f9,1852,#c7e8fc,148,#d6eefd,7.991360691144709,#d6eefd,111084.08333333333,#b9e2fb,401477,#acdcfa,33456.416666666664,#6ec1f7,"https://t.co/iSFAokoIP7",1081735898679701505,2019-01-06 03:15
2019-01-01,7,6,#edf7fe,0,#ffffff,6,#edf7fe,193894,#cae9fc,45147,#c7e7fc,781248,#c0e5fb,1132,#ddf1fd,67,#edf7fe,5.918727915194347,#e1f2fd,130208,#aeddfa,178382,#daeffd,29730.333333333332,#7cc8f8,"I am pleased to inform you that I will Address the Nation on the Humanitarian and National Security crisis on our Southern Border. Tuesday night at 9:00 P.M. Eastern.",1082347305699889157,2019-01-07 07:44
2019-01-01,8,5,#f0f8fe,0,#ffffff,5,#f0f8fe,150936,#d6eefd,32377,#d7eefd,637552,#cce9fc,917,#e4f3fd,56,#f0f8fe,6.106870229007634,#e0f2fd,127510.4,#b0defa,119795,#e6f5fe,23959,#97d3f9,"Endless Wars&#44; especially those which are fought out of judgement mistakes that were made many years ago&#44; &amp; those where we are getting little financial or military help from the rich countries that so greatly benefit from what we are doing&#44; will eventually come to a glorious end!",1082484663216730113,2019-01-08 04:50
2019-01-01,9,7,#eaf6fe,0,#ffffff,7,#eaf6fe,251282,#bae2fb,56795,#b8e1fb,1062816,#aadbfa,1113,#def1fd,74,#ebf6fe,6.648697214734951,#ddf1fd,151830.85714285713,#a1d7fa,224467,#d0ebfc,32066.714285714286,#73c4f7,"Just left a meeting with Chuck and Nancy&#44; a total waste of time. I asked what is going to happen in 30 days if I quickly open things up&#44; are you going to approve Border Security which includes a Wall or Steel Barrier? Nancy said&#44; NO. I said bye-bye&#44; nothing else works!",1083099784012091396,2019-01-09 09:34
2019-01-01,10,17,#cae9fc,0,#ffffff,17,#cae9fc,198515,#c9e8fc,55042,#bae2fb,1280328,#99d4f9,2081,#c0e5fb,196,#c9e8fc,9.418548774627583,#cfebfc,75313.41176470589,#d0ebfc,467066,#9fd6fa,27474.470588235294,#86ccf8,"MAKE AMERICA GREAT AGAIN!",1083358775925460992,2019-01-10 02:43
2019-01-01,11,11,#ddf1fd,0,#ffffff,11,#ddf1fd,177910,#ceebfc,45849,#c6e7fb,1107164,#a7dafa,1460,#d3ecfc,127,#dcf0fd,8.698630136986301,#d2ecfc,100651.27272727272,#c0e5fb,291239,#c2e6fb,26476.272727272728,#8bcef9,"Dear Diary... https://t.co/NAuMaQW6fl",1083531644785455104,2019-01-11 02:10
2019-01-01,12,16,#cdeafc,0,#ffffff,16,#cdeafc,182846,#cdeafc,41234,#cceafc,1737628,#75c4f7,2824,#abdbfa,194,#c9e8fc,6.8696883852691215,#dcf0fd,108601.75,#bbe3fb,412635,#aadbfa,25789.6875,#8ecff9,"....I do have a plan on the Shutdown. But to understand that plan you would have to understand the fact that I won the election&#44; and I promised safety and security for the American people. Part of that promise was a Wall at the Southern Border. Elections have consequences!",1084119654841364480,2019-01-12 05:07
2019-01-01,13,8,#e7f5fe,0,#ffffff,8,#e7f5fe,186443,#cceafc,32115,#d7eefd,987530,#b0defa,1304,#d8eefd,112,#e0f2fd,8.588957055214724,#d3ecfc,123441.25,#b2dffa,218119,#d2ecfc,27264.875,#87cdf8,"Wish I could share with everyone the beauty and majesty of being in the White House and looking outside at the snow filled lawns and Rose Garden. Really is something - SPECIAL COUNTRY&#44; SPECIAL PLACE!",1084571124556619776,2019-01-13 11:01
2019-01-01,14,26,#afddfa,0,#ffffff,26,#afddfa,168050,#d1ecfc,36237,#d2ecfc,1727083,#76c5f7,3631,#93d1f9,272,#b4dffb,7.491049297714128,#d9effd,66426.26923076923,#d6eefc,499781,#98d3f9,19222.346153846152,#abdbfa,"....I am doing exactly what I pledged to do&#44; and what I was elected to do by the citizens of our great Country. Just as I promised&#44; I am fighting for YOU!",1084938164387508224,2019-01-14 11:19
2019-01-01,15,19,#c4e6fb,0,#ffffff,19,#c4e6fb,213885,#c4e6fb,50770,#bfe5fb,1101738,#a7dafa,2408,#b6e0fb,237,#bde3fb,9.8421926910299,#cceafc,57986.21052631579,#dbf0fd,419026,#a9dafa,22054,#9fd6fa,"Why is Nancy Pelosi getting paid when people who are working are not?",1085166206095630336,2019-01-15 02:25
2019-01-01,16,2,#f9fcff,0,#ffffff,2,#f9fcff,187763,#cce9fc,47144,#c4e6fb,367017,#e2f3fd,361,#f4fafe,19,#fafdff,5.2631578947368425,#e4f4fd,183508.5,#8dcff9,90356,#edf7fe,45178,#3aacf3,"There are now 77 major or significant Walls built around the world&#44; with 45 countries planning or building Walls. Over 800 miles of Walls have been built in Europe since only 2015. They have all been recognized as close to 100% successful. Stop the crime at our Southern Border!",1085515276228153345,2019-01-16 01:33
2019-01-01,17,3,#f6fbfe,0,#ffffff,3,#f6fbfe,195656,#c9e9fc,43617,#c9e8fc,342395,#e4f3fd,277,#f7fbff,32,#f6fbfe,11.552346570397113,#c3e6fb,114131.66666666667,#b8e1fb,94747,#ecf7fe,31582.333333333332,#75c4f7,"The Left has become totally unhinged. They no longer care what is Right for our Countrty!",1085900696539615232,2019-01-17 03:04
2019-01-01,18,15,#d1ebfc,0,#ffffff,15,#d1ebfc,161963,#d3ecfc,41856,#cbe9fc,1494137,#88cdf8,1844,#c7e8fc,138,#d9effd,7.483731019522777,#d9effd,99609.13333333333,#c0e5fb,429256,#a7d9fa,28617.066666666666,#81caf8,"I will be making a major announcement concerning the Humanitarian Crisis on our Southern Border&#44; and the Shutdown&#44; tomorrow afternoon at 3 P.M.&#44; live from the @WhiteHouse.",1086395559504764930,2019-01-18 11:51
2019-01-01,19,25,#b2defa,0,#ffffff,25,#b2defa,172399,#d0ebfc,49902,#c1e5fb,1394994,#90d0f9,2617,#b0defa,205,#c6e7fc,7.833397019487963,#d7eefd,55799.76,#dcf0fd,570290,#89cdf9,22811.6,#9cd5f9,"Fake News is truly the ENEMY OF THE PEOPLE!",1086464467481833480,2019-01-19 04:24
