month,day,total,total-color,retweets,retweets-color,original,original-color,highestLikes,highestLikes-color,highestRetweets,highestRetweets-color,totalLikes,totalLikes-color,letters,letters-color,capitalLetters,capitalLetters-color,loudness,loudness-color,likeRate,likeRate-color,totalRetweets,totalRetweets-color,retweetRate,retweetRate-color,most-popular-text,most-popular-id,most-popular-date
2019-09-01,14,24,#b5e0fb,0,#ffffff,24,#b5e0fb,234511,#bee4fb,41347,#cce9fc,1268153,#9ad4f9,2103,#bfe4fb,222,#c1e5fb,10.556348074179743,#c9e8fc,52839.708333333336,#def1fd,362904,#b4dffb,15121,#bce3fb,"MAKE AMERICA GREAT AGAIN!",1172859963963822080,2019-09-14 03:09
2019-09-01,15,15,#d1ebfc,0,#ffffff,15,#d1ebfc,120894,#def1fd,31903,#d8eefd,825808,#bce3fb,2143,#bee4fb,192,#cae9fc,8.959402706486234,#d1ecfc,55053.86666666667,#ddf1fd,228669,#d0ebfc,15244.6,#bbe3fb,"Brett Kavanaugh should start suing people for libel&#44; or the Justice Department should come to his rescue. The lies being told about him are unbelievable. False Accusations without recrimination. When does it stop? They are trying to influence his opinions. Can’t let that happen!",1173231877181857795,2019-09-15 03:47
2019-09-01,16,29,#a6d9fa,0,#ffffff,29,#a6d9fa,115126,#e0f2fd,23779,#e2f3fd,1550031,#83cbf8,4695,#73c3f7,446,#84cbf8,9.499467518636848,#ceeafc,53449.34482758621,#def1fd,391820,#aeddfa,13511.034482758621,#c3e6fb,"PLENTY OF OIL!",1173368574406250496,2019-09-16 12:50
2019-09-01,17,17,#cae9fc,0,#ffffff,17,#cae9fc,118492,#dff1fd,28710,#dcf0fd,837593,#bbe3fb,1711,#cbe9fc,185,#cceafc,10.81239041496201,#c7e8fc,49270.17647058824,#e1f2fd,237906,#ceeafc,13994.470588235294,#c1e5fb,"I call for the Resignation of everybody at The New York Times involved in the Kavanaugh SMEAR story&#44; and while you’re at it&#44; the Russian Witch Hunt Hoax&#44; which is just as phony! They’ve taken the Old Grey Lady and broken her down&#44; destroyed her virtue and ruined her reputation...",1173728487162540032,2019-09-17 12:40
2019-09-01,18,44,#78c6f8,0,#ffffff,44,#78c6f8,103948,#e3f3fd,24907,#e0f2fd,1162201,#a3d8fa,4665,#74c4f7,476,#7cc8f8,10.203644158628082,#cae9fc,26413.659090909092,#eff8fe,504555,#97d3f9,11467.15909090909,#cceafc,"Terrence K. Williams&#44; “You can’t impeach Trump for being a winner!”",1174297506986909697,2019-09-18 02:21
2019-09-01,19,7,#eaf6fe,0,#ffffff,7,#eaf6fe,128192,#dcf0fd,29567,#dbf0fd,668040,#c9e8fc,854,#e6f4fd,40,#f4fafe,4.68384074941452,#e7f5fe,95434.28571428571,#c3e6fb,145252,#e1f2fd,20750.285714285714,#a5d9fa,"GREAT progress on the Border Wall! https://t.co/TvOYxgsBSv",1174504680400908289,2019-09-19 04:05
2019-09-01,20,16,#cdeafc,0,#ffffff,16,#cdeafc,112250,#e1f2fd,29567,#dbf0fd,637862,#cce9fc,1706,#cbe9fc,133,#dbf0fd,7.79601406799531,#d7eefd,39866.375,#e6f5fe,219799,#d1ecfc,13737.4375,#c2e6fb,"Oh no&#44; really big political news&#44; perhaps the biggest story in years! Part time Mayor of New York City&#44;  @BilldeBlasio&#44; who was polling at a solid ZERO but had tremendous room for growth&#44; has shocking dropped out of the Presidential race. NYC is devastated&#44; he’s coming home!",1175017370139729926,2019-09-20 02:02
2019-09-01,21,18,#c7e8fc,0,#ffffff,18,#c7e8fc,118112,#dff1fd,37858,#d0ebfc,926149,#b5e0fb,1942,#c4e6fb,141,#d8effd,7.260556127703398,#daeffd,51452.72222222222,#dff1fd,283225,#c4e6fb,15734.722222222223,#b9e2fb,"I want to express my gratitude to America’s magnificent @FLOTUS for tonight’s exquisite evening where we celebrated more than a century of loyal and devoted friendship between🇺🇸🇦🇺Both of our nations are blessed by uncommon courage&#44; unfailing commitment&#44; and unyielding character! https://t.co/i61cHCZYlD",1175261118161461250,2019-09-21 06:11
2019-09-01,22,19,#c4e6fb,0,#ffffff,19,#c4e6fb,179318,#ceeafc,44873,#c7e8fc,1208027,#9fd6fa,2145,#bee4fb,149,#d6eefd,6.946386946386946,#dcf0fd,63580.36842105263,#d8eefd,337485,#b9e2fb,17762.36842105263,#b1defa,"The USA Loves India! https://t.co/xlfnWafxpg",1175848139112308739,2019-09-22 09:03
2019-09-01,23,11,#ddf1fd,0,#ffffff,11,#ddf1fd,137735,#daeffd,36830,#d1ecfc,767125,#c1e5fb,1195,#dbf0fd,76,#eaf6fe,6.359832635983263,#dff1fd,69738.63636363637,#d4edfc,216804,#d2ecfc,19709.454545454544,#a9dafa,"https://t.co/J7g5L8LzrV",1175918239920140288,2019-09-23 01:42
2019-09-01,24,21,#bde4fb,0,#ffffff,21,#bde4fb,240801,#bde3fb,53469,#bce3fb,1688771,#78c6f8,1778,#c9e8fc,175,#cfebfc,9.84251968503937,#cceafc,80417.66666666667,#cdeafc,440146,#a5d9fa,20959.333333333332,#a4d8fa,"PRESIDENTIAL HARASSMENT!",1176606660279898112,2019-09-24 11:17
2019-09-01,25,39,#87ccf8,0,#ffffff,39,#87ccf8,193395,#cae9fc,38410,#cfebfc,1683477,#79c6f8,3924,#89cdf9,383,#96d2f9,9.760448521916413,#cdeafc,43166.07692307692,#e4f4fd,629976,#7cc8f8,16153.23076923077,#b8e1fb,"There has been no President in the history of our Country who has been treated so badly as I have. The Democrats are frozen with hatred and fear. They get nothing done. This should never be allowed to happen to another President. Witch Hunt!",1176819645699043328,2019-09-25 01:24
2019-09-01,26,51,#64bdf6,0,#ffffff,51,#64bdf6,123913,#def1fd,38366,#cfebfc,1060321,#abdbfa,4145,#82caf8,582,#62bbf6,14.041013268998794,#b7e1fb,20790.607843137255,#f2fafe,680612,#73c4f7,13345.333333333334,#c4e6fb,"Liddle’ Adam Schiff&#44; who has worked unsuccessfully for 3 years to hurt the Republican Party and President&#44; has just said that the Whistleblower&#44; even though he or she only had second hand information&#44; “is credible.” How can that be with zero info and a known bias. Democrat Scam!",1177285017636093953,2019-09-26 08:13
2019-09-01,27,28,#a9dbfa,0,#ffffff,28,#a9dbfa,279665,#b3dffa,96936,#87ccf8,2002625,#62bbf6,3193,#a0d6fa,341,#a2d7fa,10.679611650485437,#c8e8fc,71522.32142857143,#d2ecfc,565774,#8acef9,20206.214285714286,#a7dafa,"I AM DRAINING THE SWAMP! https://t.co/U7WxKrO6Kx",1177669563477118976,2019-09-27 09:41
2019-09-01,28,14,#d4edfc,0,#ffffff,14,#d4edfc,253645,#b9e2fb,72263,#a6d9fa,1025940,#addcfa,899,#e4f4fd,177,#ceeafc,19.688542825361512,#9bd4f9,73281.42857142857,#d1ecfc,325680,#bbe3fb,23262.85714285714,#9ad4f9,"They are trying to stop ME&#44; because I am fighting for YOU! https://t.co/xiw4jtjkNl",1178055467987275776,2019-09-28 11:14
2019-09-01,29,63,#3cadf3,0,#ffffff,63,#3cadf3,113434,#e0f2fd,88649,#92d1f9,1169728,#a2d8fa,5436,#5fbaf6,685,#42aff4,12.601177336276674,#bee4fb,18567.11111111111,#f4fafe,826613,#57b7f5,13120.84126984127,#c5e7fb,"How do you impeach a President who has created the greatest Economy in the history of our Country&#44; entirely rebuilt our Military into the most powerful it has ever been&#44; Cut Record Taxes &amp; Regulations&#44; fixed the VA &amp; gotten Choice for our Vets (after 45 years)&#44; &amp; so much more?...",1178067055226052609,2019-09-29 12:00
2019-09-01,30,38,#8acef9,0,#ffffff,38,#8acef9,130386,#dcf0fd,96967,#87ccf8,2592624,#36a8f1,5577,#5ab8f6,649,#4eb4f5,11.637080867850099,#c3e6fb,68226.94736842105,#d5edfc,800573,#5cb9f6,21067.71052631579,#a3d8fa,"Like every American&#44; I deserve to meet my accuser&#44; especially when this accuser&#44; the so-called “Whistleblower&#44;” represented a perfect conversation with a foreign leader in a totally inaccurate and fraudulent way. Then Schiff made up what I actually said by lying to Congress......",1178442759499370496,2019-09-30 12:53
2019-10-01,1,28,#a9dbfa,0,#ffffff,28,#a9dbfa,214037,#c4e6fb,56381,#b9e2fb,1427392,#8dcff9,3099,#a3d8fa,312,#aadbfa,10.067763794772507,#cbe9fc,50978.28571428572,#e0f2fd,586319,#86ccf8,20939.964285714286,#a4d8fa,"https://t.co/dOta1Z9gtZ",1178989254309011456,2019-10-01 01:05
2019-10-01,2,24,#b5e0fb,0,#ffffff,24,#b5e0fb,419383,#8dcff9,122631,#6abff7,2294950,#49b2f5,3530,#96d2f9,350,#9fd6fa,9.91501416430595,#cceafc,95622.91666666667,#c3e6fb,657732,#77c6f8,27405.5,#87ccf8,"LOOK AT THIS PHOTOGRAPH! https://t.co/QQYTqG4KTt",1179502966606352386,2019-10-02 11:06
2019-10-01,3,42,#7dc8f8,0,#ffffff,42,#7dc8f8,126397,#ddf0fd,106420,#7bc8f8,1694481,#78c6f8,3283,#9dd5f9,408,#8fd0f9,12.427657630216265,#bee4fb,40344.78571428572,#e6f4fd,725609,#6bc0f7,17276.404761904763,#b3dffa,"95% Approval Rating in the Republican Party&#44; and record setting fundraising that has taken place over the past two weeks. Thank you!",1179807522116575232,2019-10-03 07:16
2019-10-01,4,31,#a0d7fa,0,#ffffff,31,#a0d7fa,183640,#cdeafc,42028,#cbe9fc,1880798,#6bc0f7,3247,#9ed6fa,302,#acdcfa,9.300893132121958,#cfebfc,60670.903225806454,#d9effd,589006,#85ccf8,19000.1935483871,#acdcfa,"As the President of the United States&#44; I have an absolute right&#44; perhaps even a duty&#44; to investigate&#44; or have investigated&#44; CORRUPTION&#44; and that would include asking&#44; or suggesting&#44; other Countries to help us out!",1179925259417468928,2019-10-04 03:04
2019-10-01,5,49,#6abff7,0,#ffffff,49,#6abff7,212552,#c5e7fb,51066,#bfe4fb,2421115,#3cadf4,4808,#70c2f7,523,#71c2f7,10.877703826955075,#c7e7fc,49410.510204081635,#e1f2fd,869960,#4db3f5,17754.285714285714,#b1defa,"So Crooked Hillary Clinton can delete and acid wash 33&#44;000 emails AFTER getting a Subpoena from the United States Congress&#44; but I can’t make one totally appropriate telephone call to the President of Ukraine? Witch Hunt!",1180564696979648513,2019-10-05 09:25
2019-10-01,6,36,#90d0f9,0,#ffffff,36,#90d0f9,145927,#d7eefd,51066,#bfe4fb,1595038,#7fc9f8,3400,#9ad4f9,383,#96d2f9,11.264705882352942,#c5e7fb,44306.61111111111,#e4f3fd,643251,#7ac7f8,17868.083333333332,#b1defa,"DRAIN THE SWAMP!",1180939260146470912,2019-10-06 10:13
2019-10-01,7,38,#8acef9,0,#ffffff,38,#8acef9,176828,#cfebfc,40657,#cdeafc,1979884,#64bcf6,5663,#58b7f5,567,#66bdf6,10.012360939431396,#cbe9fc,52102.21052631579,#dff1fd,602140,#82caf8,15845.78947368421,#b9e2fb,"Unemployment Rate just dropped to 3.5%&#44; the lowest in more that 50 years. Is that an impeachable event for your President?",1180990908000559104,2019-10-07 01:39
2019-10-01,8,50,#67bef6,0,#ffffff,50,#67bef6,124168,#ddf1fd,33462,#d6eefc,1345497,#94d2f9,5894,#50b4f5,564,#66bdf6,9.569053274516458,#ceeafc,26909.94,#eff8fe,691318,#72c3f7,13826.36,#c2e5fb,"I think that Crooked Hillary Clinton should enter the race to try and steal it away from Uber Left Elizabeth Warren. Only one condition. The Crooked one must explain all of her high crimes and misdemeanors including how &amp; why she deleted 33&#44;000 Emails AFTER getting “C” Subpoena!",1181571571787403265,2019-10-08 04:06
2019-10-01,9,49,#6abff7,0,#ffffff,49,#6abff7,107783,#e2f3fd,28518,#dcf0fd,2122167,#58b7f5,5677,#57b7f5,682,#43b0f4,12.013387352474899,#c1e5fb,43309.5306122449,#e4f4fd,695529,#71c2f7,14194.469387755102,#c0e5fb,"So pathetic to see Sleepy Joe Biden&#44; who with his son&#44; Hunter&#44; and to the detriment of the American Taxpayer&#44; has ripped off at least two countries for millions of dollars&#44; calling for my impeachment - and I did nothing wrong. Joe’s Failing Campaign gave him no other choice!",1181991604493656064,2019-10-09 07:55
2019-10-01,10,25,#b2defa,0,#ffffff,25,#b2defa,122735,#def1fd,33816,#d5edfc,1548485,#83cbf8,3046,#a4d8fa,257,#b8e1fb,8.437294812869338,#d4edfc,61939.4,#d9effd,431849,#a6d9fa,17273.96,#b3dffa,"WOW&#44; THANK YOU Minneapolis&#44; Minnesota — on my way! #KAG2020 https://t.co/Czl6GbCCxN",1182399270009425920,2019-10-10 10:55
2019-10-01,11,44,#78c6f8,0,#ffffff,44,#78c6f8,99936,#e4f4fd,25621,#e0f2fd,879033,#b8e1fb,4089,#84cbf8,482,#7ac7f8,11.787723159696748,#c2e6fb,19978.022727272728,#f3fafe,383874,#b0ddfa,8724.40909090909,#d9effd,"A GREAT evening in Minneapolis&#44; Minnesota with incredible American Patriots. THANK YOU! https://t.co/b3UQEo0wPq",1182485222190915584,2019-10-11 04:37
2019-10-01,12,36,#90d0f9,0,#ffffff,36,#90d0f9,143922,#d8eefd,30219,#daeffd,1518088,#86ccf8,3677,#91d0f9,432,#88cdf8,11.748708186021213,#c2e6fb,42169.11111111111,#e5f4fd,493856,#9ad4f9,13718.222222222223,#c2e6fb,"The Endless Wars Must End!",1183130243885875200,2019-10-12 11:20
2019-10-01,13,20,#c0e5fb,0,#ffffff,20,#c0e5fb,122233,#def1fd,27397,#ddf1fd,1213547,#9fd6fa,2763,#acdcfa,338,#a3d8fa,12.233079985522982,#bfe5fb,60677.35,#d9effd,346221,#b7e1fb,17311.05,#b3dffa,"We have become a far greater Economic Power than ever before&#44; and we are using that power for WORLD PEACE!",1183390085993119749,2019-10-13 04:32
2019-10-01,14,35,#94d1f9,0,#ffffff,35,#94d1f9,152236,#d6eefc,29851,#daeffd,2227210,#4fb4f5,4711,#73c3f7,540,#6dc0f7,11.46253449373806,#c4e6fb,63634.57142857143,#d8eefd,596802,#83cbf8,17051.485714285714,#b4dffb,"America First!",1183796209942695938,2019-10-14 07:26
2019-10-01,15,17,#cae9fc,0,#ffffff,17,#cae9fc,131177,#dcf0fd,35933,#d3ecfc,1211538,#9fd6fa,2677,#afddfa,361,#9cd5f9,13.485244676877102,#b9e2fb,71266.94117647059,#d3ecfc,350894,#b6e0fb,20640.823529411766,#a5d9fa,"Now that we have found out that @CNN is a virtual fraud&#44; rumor has it that Jeff Zucker will be resigining momentarily?",1184168291775995904,2019-10-15 08:04
2019-10-01,16,20,#c0e5fb,0,#ffffff,20,#c0e5fb,152177,#d6eefc,45680,#c6e7fc,1450093,#8bcef9,2328,#b9e1fb,274,#b3dffb,11.769759450171822,#c2e6fb,72504.65,#d2ecfc,432212,#a6d9fa,21610.6,#a1d7fa,"We now have the greatest Economy in history! https://t.co/8fLOejOpxH",1184308485237948416,2019-10-16 05:22
2019-10-01,17,36,#90d0f9,0,#ffffff,36,#90d0f9,191097,#cbe9fc,48787,#c2e6fb,2110077,#59b8f6,3876,#8bcef9,355,#9ed6f9,9.158926728586172,#d0ebfc,58613.25,#dbf0fd,908326,#43b0f4,25231.277777777777,#91d0f9,"Nancy Pelosi needs help fast! There is either something wrong with her “upstairs&#44;” or she just plain doesn’t like our great Country. She had a total meltdown in the White House today. It was very sad to watch. Pray for her&#44; she is a very sick person!",1184620202480193537,2019-10-17 02:00
2019-10-01,18,20,#c0e5fb,0,#ffffff,20,#c0e5fb,149542,#d6eefd,33385,#d6eefc,1083641,#a9dafa,2386,#b7e1fb,233,#bee4fb,9.765297569153395,#cdeafc,54182.05,#def1fd,321603,#bce3fb,16080.15,#b8e1fb,"Can you believe I am doing this important work for our Country&#44; and have to deal with Corrupt Adam Schiff and the Do Nothing Democrats at the same time? It was not intended to be this way for a President!",1185221926991609862,2019-10-18 05:51
2019-10-01,19,55,#58b7f5,0,#ffffff,55,#58b7f5,129925,#dcf0fd,35686,#d3ecfc,1457769,#8bcef9,4962,#6cc0f7,578,#63bcf6,11.648528819024587,#c3e6fb,26504.890909090907,#eff8fe,712315,#6ec1f7,12951.181818181818,#c6e7fb,"Susan Rice&#44; who was a disaster to President Obama as National Security Advisor&#44; is now telling us her opinion on what to do in Syria. Remember RED LINE IN THE SAND? That was Obama. Millions killed! No thanks Susan&#44; you were a disaster.",1185389914470473729,2019-10-19 04:59
2019-10-01,20,25,#b2defa,0,#ffffff,25,#b2defa,169519,#d1ecfc,37348,#d1ecfc,1336352,#95d2f9,3001,#a5d9fa,364,#9cd5f9,12.129290236587805,#c0e5fb,53454.08,#def1fd,428551,#a7dafa,17142.04,#b4dffb,"So now Crooked Hillary is at it again! She is calling Congresswoman Tulsi Gabbard “a Russian favorite&#44;” and Jill Stein “a Russian asset.” As you may have heard&#44; I was called a big Russia lover also (actually&#44; I do like Russian people. I like all people!). Hillary’s gone Crazy!",1185747939257397248,2019-10-20 04:41
2019-10-01,21,18,#c7e8fc,0,#ffffff,18,#c7e8fc,96055,#e5f4fd,23827,#e2f3fd,686049,#c8e8fc,1502,#d2ecfc,191,#cae9fc,12.716378162450066,#bde4fb,38113.833333333336,#e8f5fe,262266,#c8e8fc,14570.333333333334,#bee4fb,"Censure (at least) Corrupt Adam Schiff! After what he got caught doing&#44; any pol who does not so vote cannot be honest....are you listening Dems?",1186258762920792065,2019-10-21 02:31
2019-10-01,22,41,#80caf8,0,#ffffff,41,#80caf8,154062,#d5edfc,38602,#cfebfc,977212,#b1defa,4423,#7ac7f8,452,#82cbf8,10.219308161881075,#cae9fc,23834.439024390245,#f0f9fe,495644,#99d4f9,12088.878048780487,#cae9fc,"So some day&#44; if a Democrat becomes President and the Republicans win the House&#44; even by a tiny margin&#44; they can impeach the President&#44; without due process or fairness or any legal rights. All Republicans must remember what they are witnessing here - a lynching. But we will WIN!",1186611272231636992,2019-10-22 01:52
2019-10-01,23,48,#6dc0f7,0,#ffffff,48,#6dc0f7,130416,#dcf0fd,28445,#dcf0fd,1423251,#8ecff9,5261,#64bcf6,526,#70c2f7,9.998099220680478,#cce9fc,29651.0625,#edf7fe,635105,#7bc8f8,13231.354166666666,#c4e7fb,"Where’s the Whistleblower?",1186985677176655872,2019-10-23 02:40
2019-10-01,24,14,#d4edfc,0,#ffffff,14,#d4edfc,103828,#e3f3fd,28857,#dcf0fd,569953,#d1ecfc,1459,#d3ecfc,122,#def1fd,8.36189170664839,#d4edfc,40710.92857142857,#e6f4fd,213798,#d3ecfc,15271.285714285714,#bbe3fb,"Thank you to House Republicans for being tough&#44; smart&#44; and understanding in detail the greatest Witch Hunt in American History. It has been going on since long before I even got Elected (the Insurance Policy!). A total Scam!",1187375419022069761,2019-10-24 04:28
2019-10-01,25,35,#94d1f9,0,#ffffff,35,#94d1f9,134301,#dbf0fd,32627,#d7eefd,826945,#bce3fb,4537,#77c5f8,453,#82caf8,9.984571302622879,#cce9fc,23627,#f1f9fe,405303,#acdcfa,11580.085714285715,#cceafc,"Where is the Whistleblower&#44; and why did he or she write such a fictitious and incorrect account of my phone call with the Ukrainian President? Why did the IG allow this to happen? Who is the so-called Informant (Schiff?) who was so inaccurate? A giant Scam!",1187547459700121600,2019-10-25 03:52
2019-10-01,26,44,#78c6f8,0,#ffffff,44,#78c6f8,141510,#d9effd,31396,#d8effd,2298129,#48b1f5,5715,#56b7f5,523,#71c2f7,9.151356080489938,#d0ebfc,52230.204545454544,#dff1fd,785161,#60baf6,17844.56818181818,#b1defa,"To Tim: The Button on the IPhone was FAR better than the Swipe!",1187861209942495234,2019-10-26 12:39
2019-10-01,27,7,#eaf6fe,0,#ffffff,7,#eaf6fe,370738,#9bd4f9,75439,#a2d8fa,862821,#b9e2fb,418,#f3fafe,35,#f6fbfe,8.373205741626794,#d4edfc,123260.14285714286,#b2dffa,229510,#cfebfc,32787.142857142855,#71c2f7,"Something very big has just happened!",1188264965930700801,2019-10-27 02:23
2019-10-01,28,14,#d4edfc,0,#ffffff,14,#d4edfc,574621,#66bdf6,131283,#60baf6,1053605,#abdbfa,1318,#d7eefd,221,#c1e5fb,16.76783004552352,#aadbfa,75257.5,#d0ebfc,418265,#a9dafa,29876.071428571428,#7cc8f8,"We have declassified a picture of the wonderful dog (name not declassified) that did such a GREAT JOB in capturing and killing the Leader of ISIS&#44; Abu Bakr al-Baghdadi! https://t.co/PDMx9nZWvw",1188909031403900928,2019-10-28 09:02
2019-10-01,29,48,#6dc0f7,0,#ffffff,48,#6dc0f7,252377,#bae2fb,52002,#bee4fb,1521544,#85ccf8,5901,#50b4f5,575,#64bcf6,9.744111167598712,#cdeafc,31698.833333333332,#ecf7fe,651393,#79c6f8,13570.6875,#c3e6fb,"Just confirmed that Abu Bakr al-Baghdadi’s number one replacement has been terminated by American troops. Most likely would have taken the top spot - Now he is also Dead!",1189172468159864832,2019-10-29 02:29
2019-10-01,30,34,#97d3f9,0,#ffffff,34,#97d3f9,440073,#87cdf8,87593,#93d1f9,1579362,#80caf8,4553,#77c5f7,374,#99d4f9,8.214364155501867,#d5edfc,46451.82352941176,#e2f3fd,624985,#7dc8f8,18381.91176470588,#afddfa,"AMERICAN HERO! https://t.co/XCCa2sGfsZ",1189601417469841409,2019-10-30 06:54
2019-10-01,31,37,#8dcff9,0,#ffffff,37,#8dcff9,181124,#ceeafc,52449,#bde4fb,1296511,#98d3f9,4110,#83cbf8,410,#8fcff9,9.975669099756692,#cce9fc,35040.83783783784,#e9f6fe,596621,#83cbf8,16124.891891891892,#b8e1fb,"The Greatest Witch Hunt In American History!",1189927952168996865,2019-10-31 04:31
2019-11-01,1,36,#90d0f9,0,#ffffff,36,#90d0f9,287061,#b1defa,52316,#bde4fb,2333617,#45b0f4,4766,#71c3f7,386,#95d2f9,8.09903483004616,#d6edfc,64822.694444444445,#d7eefd,558593,#8ccef9,15516.472222222223,#bae2fb,"You can’t Impeach someone who hasn’t done anything wrong!",1190400372180807681,2019-11-01 11:48
2019-11-01,2,36,#90d0f9,0,#ffffff,36,#90d0f9,149164,#d7eefd,37960,#d0ebfc,701503,#c6e7fc,3753,#8fcff9,392,#94d1f9,10.444977351452172,#c9e8fc,19486.194444444445,#f3fafe,571083,#89cdf9,15863.416666666666,#b9e2fb,"The Whistleblower has disappeared. Where is the Whistleblower?",1190734818595758085,2019-11-02 09:57
2019-11-01,3,24,#b5e0fb,0,#ffffff,24,#b5e0fb,109990,#e1f2fd,27437,#ddf1fd,1331003,#95d2f9,3157,#a1d7fa,327,#a6d9fa,10.35793474817865,#cae9fc,55458.458333333336,#ddf0fd,414165,#aadbfa,17256.875,#b3dffa,"The Whistleblower got it sooo wrong that HE must come forward. The Fake News Media knows who he is but&#44; being an arm of the Democrat Party&#44; don’t want to reveal him because there would be hell to pay. 
 Reveal the Whistleblower and end the Impeachment Hoax!",1191000516580519937,2019-11-03 03:33
2019-11-01,4,37,#8dcff9,0,#ffffff,37,#8dcff9,133413,#dbf0fd,27101,#def1fd,1615372,#7dc9f8,4432,#7ac7f8,327,#a6d9fa,7.378158844765343,#d9effd,43658.7027027027,#e4f4fd,550016,#8ecff9,14865.297297297297,#bde3fb,"95% Approval Rating in the Republican Party. Thank you!",1191338937387757568,2019-11-04 01:58
2019-11-01,5,41,#80caf8,0,#ffffff,41,#80caf8,193333,#cae9fc,48059,#c3e6fb,1031526,#addcfa,4782,#71c2f7,563,#67bef6,11.77331660393141,#c2e6fb,25159.170731707316,#f0f8fe,545710,#8fcff9,13310,#c4e6fb,"This is the time for Mexico&#44; with the help of the United States&#44; to wage WAR on the drug cartels and wipe them off the face of the earth. We merely await a call from your great new president!",1191708902041227264,2019-11-05 02:28
2019-11-01,6,21,#bde4fb,0,#ffffff,21,#bde4fb,168317,#d1ecfc,31121,#d9effd,1058187,#abdbfa,2625,#b0defa,249,#bae2fb,9.485714285714286,#ceeafc,50389.857142857145,#e0f2fd,307802,#bee4fb,14657.238095238095,#bee4fb,"Stock Markets (all three) hit another ALL TIME &amp; HISTORIC HIGH yesterday! You are sooo lucky to have me as your President (just kidding!). Spend your money well!",1192071660494565377,2019-11-06 02:30
2019-11-01,7,21,#bde4fb,0,#ffffff,21,#bde4fb,133371,#dbf0fd,35608,#d3ecfc,1281662,#99d4f9,2655,#afddfa,324,#a6d9fa,12.203389830508474,#c0e5fb,61031.52380952381,#d9effd,359239,#b5e0fb,17106.619047619046,#b4dffb,"It was just explained to me that for next weeks Fake Hearing (trial) in the House&#44; as they interview Never Trumpers and others&#44; I get NO LAWYER &amp; NO DUE PROCESS. It is a Pelosi&#44; Schiff&#44; Scam against the Republican Party and me. This Witch Hunt should not be allowed to proceed!",1192460764235419654,2019-11-07 04:16
2019-11-01,8,6,#edf7fe,0,#ffffff,6,#edf7fe,116241,#e0f2fd,33508,#d6eefc,324192,#e5f4fd,465,#f1f9fe,90,#e6f5fe,19.35483870967742,#9dd5f9,54032,#def1fd,139525,#e2f3fd,23254.166666666668,#9ad4f9,"https://t.co/z0I7wBsgTP",1192640102943674368,2019-11-08 04:08
2019-11-01,9,44,#78c6f8,0,#ffffff,44,#78c6f8,177062,#cfebfc,33508,#d6eefc,889783,#b7e1fb,4403,#7bc7f8,475,#7cc8f8,10.78809902339314,#c7e8fc,20222.340909090908,#f3fafe,514750,#95d2f9,11698.863636363636,#cbe9fc,"Just finished reading my son Donald’s just out new book&#44; “Triggered.” It is really good! He&#44; along with many of us&#44; was very unfairly treated. But we all fight back&#44; and we always win!",1193190844012122113,2019-11-09 04:37
2019-11-01,10,50,#67bef6,27,#68bef6,23,#b8e1fb,156844,#d4edfc,40608,#cdeafc,1176571,#a2d7fa,1709,#cbe9fc,180,#cdeafc,10.53247513165594,#c9e8fc,23531.42,#f1f9fe,718242,#6dc0f7,14364.84,#bfe4fb,"Thank you to LSU and Alabama for a great game!",1193327464308625409,2019-11-10 01:40
2019-11-01,11,33,#9ad4f9,15,#aadbfa,18,#c7e8fc,168637,#d1ecfc,31661,#d8eefd,1221215,#9ed6f9,1981,#c3e6fb,174,#cfebfc,8.78344270570419,#d2ecfc,37006.51515151515,#e8f5fe,484808,#9bd5f9,14691.151515151516,#bee4fb,"HAPPY VETERANS DAY!",1193886728790171649,2019-11-11 02:42
2019-11-01,12,20,#c0e5fb,4,#e8f5fe,16,#cdeafc,129712,#dcf0fd,32384,#d7eefd,1153093,#a4d8fa,2252,#bbe2fb,155,#d4edfc,6.8827708703374775,#dcf0fd,57654.65,#dbf0fd,325699,#bbe3fb,16284.95,#b7e1fb,"In order to continue being the most Transparent President in history&#44; I will be releasing sometime this week the Transcript of the first&#44; and therefore most important&#44; phone call I had with the President of Ukraine. I am sure you will find it tantalizing!",1194035922066714625,2019-11-12 12:35
2019-11-01,13,43,#7ac7f8,3,#eef8fe,40,#83cbf8,113173,#e0f2fd,30963,#d9effd,863686,#b9e2fb,4616,#75c4f7,418,#8ccef9,9.055459272097053,#d1ebfc,20085.720930232557,#f3fafe,625361,#7dc8f8,14543.279069767443,#bee4fb,"READ THE TRANSCRIPT!",1194608581590564865,2019-11-13 02:30
2019-11-01,14,32,#9dd5f9,0,#ffffff,32,#9dd5f9,163741,#d2ecfc,30488,#d9effd,888315,#b8e1fb,3324,#9cd5f9,299,#addcfa,8.995186522262335,#d1ecfc,27759.84375,#eef8fe,425894,#a7dafa,13309.1875,#c4e6fb,"Wow! Was just told that my son’s book&#44; “Triggered&#44;” is Number One on The New York Times Bestseller List. Congratulations Don!",1194824072011698176,2019-11-14 04:47
2019-11-01,15,45,#75c4f7,18,#99d4f9,27,#acdcfa,154339,#d5edfc,47234,#c4e6fb,1415453,#8ecff9,3166,#a1d7fa,298,#addcfa,9.412507896399243,#cfebfc,31454.51111111111,#ecf7fe,752827,#66bdf6,16729.48888888889,#b5e0fb,"So they now convict Roger Stone of lying and want to jail him for many years to come. Well&#44; what about Crooked Hillary&#44; Comey&#44; Strzok&#44; Page&#44; McCabe&#44; Brennan&#44; Clapper&#44; Shifty Schiff&#44; Ohr &amp; Nellie&#44; Steele &amp; all of the others&#44; including even Mueller himself? Didn’t they lie?....",1195389483664990208,2019-11-15 06:13
2019-11-01,16,24,#b5e0fb,9,#cbe9fc,15,#d1ebfc,119453,#dff1fd,35340,#d3edfc,887135,#b8e1fb,1578,#cfebfc,244,#bbe3fb,15.462610899873257,#b0defa,36963.958333333336,#e8f5fe,401688,#acdcfa,16737,#b5e0fb,"Dow hits 28&#44;000 - FIRST TIME EVER&#44; HIGHEST EVER! Gee&#44; Pelosi &amp; Schitt have a good idea&#44; “lets Impeach the President.” If something like that ever happened&#44; it would lead to the biggest FALL in Market History. It’s called a Depression&#44; not a Recession! So much for 401-K’s &amp; Jobs!",1195722806274736129,2019-11-16 04:18
